name,brand,price,size1,ingredients,url,category,subcategory
Hydrating Glossy Fruit Lip Stain,Mango People,$24.00 ,Color: Rose Milk - nude pink,"-Mango Seed Butter: Adds deep hydration that leaves lips soft, smooth, and nourished. -Plum Extract: Boosts elasticity and helps smooth lip lines. -Wild Cherry Extract: Helps calm irritation and restore lip softness. Water, Phytosteryl/lsostearyl/Cetyl/Stearyl/Behenyl Dimer, Trimethvlsiloxvohenvl Dimethicone, Diisostearyl Malate, Diphenyl Dimethicone, Bis-Diglyceryl Polyacyladipate-2, Diqlycerin, Cetyl PEG/PPG-10/1Dimethicone, Dipropylene Glycol, Titanium Dioxide (Cl 77891), Ceteareth-20, Sorbitan lsostearate, Hydroxyethyl Acrylate/Sodium Acryloyldimethyl Taurate, Blue 1 (Cl 42090), Blue 1 Lake (Cl 42090), Carthamus Tinctorius (Safflower) Seed Oil, Ethylhexylglycerin, Flavor, Glycerin, Iron Oxides (Cl 77491), Iron Oxides (Cl 77492), Iron Oxides(Cl 77499), Mangifera lndica (Mango) Seed Butter, Orange 4 (Cl 15510), Pentaerythrityl Tetra-di-I-butyl Hydroxyhydrocinnamate, Phenoxyethanol, Polysorbate 60, Prunus Domestica Seed Oil, Prunus Persica (Peach) Fruit Extract, Prunus Serotina (Wild Cherry) Fruit Extract, Red 33 (Cl 17200), Rubus ldaeus (Raspberry) Seed Oil, Squalane ,Tocopherol, Tocopheryl Acetate, Trisodium Ethylenediamine Disuccinate, Yellow 5 (Cl 19140).",https://www.sephora.com/product/hydrating-glossy-fruit-lip-stain-P519492,Lip Care,Hydrating
Pearl Peptide Glaze 3-in-1 Essence Toner Serum for Hydration & Redness,MARA,$54.00 ,Size: 3.4 oz / 100 mL,"-Pearl Powder: A mineral-rich marine superfood that supports collagen for youthful-looking skin. -Peptides: Vegan, marine collagen peptides intensely moisturize and support collagen production. -Beta Glucan: A super hydrating hyaluronic acid substitute for all-day-long glow. Sea Silt Extract, Water (Aqua), Propanediol, Glyceryl Oleate Citrate, Octyldodecanol, Glycerin, Hydrogenated Coco-Glycerides, Squalane, Pearl Powder, Beta-Glucan, Palmitoyl Tripeptide-1, Sr-Hydrozoan Polypeptide-1, Berberis Vulgaris Root Extract, Acer Saccharum (Sugar Maple) Extract, Bosellia Carterii Oil, Gluconolactone, Vaccinium Myrtillus Fruit Extract, Sea Water (Maris Aqua), Citrus Aurantium Bergamia (Bergamot) Peel Oil, Citrus Aurantium Dulcis (Orange) Fruit Extract, Citrus Limon (Lemon) Fruit Extract, Hydroxyethylcellulose, Lecithin, Panthenol, Pelvetia Canaliculata Extract, Pentelyne Glycol, Potassium Sorbate, Saccharum Officinarum (Sugar Cane) Extract, Sodium Acrylates Copolymer, Sodium Benzoate, Sodium Hydroxide, Sodium Phytate, Benzyl Alcohol, Calcium Gluconate, Caprylyl Glycol, Citric Acid, Dehydroacetic Acid, Disodium Phosphate, Hydroacetophenone, Sodium Citrate, Sodium Phosphate, Limonene, Linalool.",https://www.sephora.com/product/pearl-peptide-glaze-hydrating-brightening-facial-essence-P515733,Serum,"Anti-Aging, Hydrating, Soothing"
Algae Enzyme Cleansing Oil Makeup Remover with Chia + Moringa,MARA,$58.00 ,Size: 4 oz / 120 mL,"-Pumpkin, Pineapple, Papaya, and Grapefruit Enzymes: Skin-smoothing fruit enzymes gently exfoliate and visibly brighten dull skin. -Squalane, Chia, and Moringa: Act as superfood hydrators that are rich in nutrients and omegas. -Spirulina and Kelp: Boost hydration and nourish skin for a superclean feeling. Simmondsia Chinensis (Jojoba) Seed Oil, Caprylic/Capric Triglyceride, Helianthus Annuus (Sunflower) Seed Oil, Moringa Oleifera Seed Oil, Squalane, Polyglyceryl-3 Laurate, Polyglyceryl-2 Caprate, Silica, Aloe Barbadensis Extract, Carica Papaya (Papaya) Fruit Extract, Chamomilla Recutita (Matricaria) Flower Extract, Chrondus Crispus Extract, Citrus Grandis (Grapefruit) Fruit Extract, Lactobacillus/Pumpkin Ferment Extract, Laminaria Digitata Extract, Spirulina Maxima Extract, Citrus Aurantium Bergamia (Bergamot) Fruit Oil, Salvia Hispanica Seed Oil, Bromelain, Tocopheryl Acetate, Maltodextrin, Leuconostoc/Radish Root Ferment Filtrate, Limonene. .",https://www.sephora.com/product/mara-beauty-chia-moringa-algae-enzyme-cleansing-oil-P503992,Cleanser,
Oil Free Moisturizer Broad Spectrum SPF 30,Mario Badescu,$28.00 ,Size: 2 oz/ 59 mL,"-Avobenzone 3%, Octinoxate 7.5%, Octisalate 5%, Octocrylene 10%: Offer sun protection. -Green Tea Extract: Provides antioxidant benefits. -St. John's Wort Extract: Soothes redness. -Aloe Vera: Hydrates and soothes. Water, Glycerin, Aluminum Starch Octenylsuccinate, Dimethicone, Cetearyl Alcohol, Ethylhexyl Methoxycrylene, PPG-2 Myristyl Ether Propionate, C12-15 Alkyl Benzoate, Ceteareth-20, Sorbitan Oleate, Aloe Barbadensis Leaf Juice, Camellia Oleifera Leaf Extract, Hypericum Perforatum Extract, Ethylhexylglycerin, Tetrasodium Glutamate Diacetate, PEG-100 Stearate, Caprylyl Glycol, Carbomer, Fragrance, Phenoxyethanol, Sodium Hydroxide.",https://www.sephora.com/product/mario-badescu-oil-free-moisturizer-broad-spectrum-spf-30-P440493,Moisturizer,Sunscreen
Vitamin C Serum,Mario Badescu,$45.00 ,Size: 1 oz/ 29 mL,#NAME?,https://www.sephora.com/product/mario-badescu-vitamin-c-serum-P440494,Serum,Brightening
"Facial Spray with Aloe, Chamomile and Lavender",Mario Badescu,$8.00 ,Size: 4 oz/ 118 mL,"-Lavender Oil: Known for its relaxing aroma. -Lavender Essential Water: Provides hydrating and calming properties. -Chamomile Extract: Boosts calming properties. Water, Lavandula Angustifolia (Lavender) Flower Water, Propylene Glycol, Polysorbate 20, Aloe Barbadensis Leaf Juice, Lavandula Angustifolia (Lavender) Oil, Chamomilla Recutita (Matricaria) Flower Extract, Fucus Vesiculosus Extract, Ethyl Ascorbic Acid, Thymus Vulgaris (Thyme) Leaf Extract, Silver Citrate, Potassium Sorbate, Sodium Benzoate, Benzophenone-4, Triethanolamine, Zeolite, Citric Acid, Sodium Chloride, CI 60730 (Violet 2).",https://www.sephora.com/product/mario-badescu-facial-spray-with-aloe-chamomile-lavender-P440484,Toner,
MAXIMALIST AGE-DEFYING RICH MOISTURIZER with 4% Peptide & Hyaluronic Acid Blend,MATTER OF FACT,$80.00 ,Size: 1.6 oz,"-Matrixyl 3000™ (Two Signal Peptides) and Hyaluronic Acid (Four Molecular Weights) 4%: Improve the appearance of fine lines while hydrating and smoothing skin. -Niacinamide: Supports the barrier for visibly calmer, more resilient, even-toned skin. -Hexylresorcinol: Improves the appearance of dark spots for more even-toned skin. Water, Diisostearyl Malate, Pentaerythrityl Tetraethylhexanoate, Pentaerythrityl Tetraisostearate, Niacinamide, Glyceryl Stearate, Propanediol, Polyglyceryl-10 Decaisostearate, Glycerin, Polyglyceryl-6 Palmitate/Succinate, Cetearyl Alcohol, Caprylic/Capric Triglyceride, Palmitoyl Tripeptide-1, Palmitoyl Tetrapeptide-7, Polyacrylate Crosspolymer-6, Sodium Hyaluronate, Sodium Hyaluronate Crosspolymer, Hydrolyzed Sodium Hyaluronate, Sodium Acetylated Hyaluronate, 1,2 Hexanediol, Bakuchiol, Ethyl Linoleate, Hexylresorcinol, Butylene Glycol, Carbomer, Polysorbate 20, Caprylhydroxamic Acid, Propanediol, Pentylene Glycol , Ethylhexylglycerin, Phytic Acid.",https://www.sephora.com/product/matter-of-fact-maximalist-age-defying-moisturizer-with-4-peptide-hyaluronic-acid-blend-niacinamide-hexylresorcinol-bakuchiol-P509464,Moisturizer,"Anti-Aging, Hydrating, Nourishing"
MINIMALIST HYDRATING MOISTURIZER with Pro-Vitamin B5,MATTER OF FACT,$76.00 ,Size: 1.6 oz / 50 ml,"-5% Pro-Vitamin B5: Also known as panthenol, proven to provide gentle yet intense hydration to parched skin. -Liquid Crystal Lipids: Skin-mimicking lipids thoroughly moisturize, condition, and support skin barrier. -Centella Asiatica: Provides potent antioxidant defense while visibly soothing and calming skin. Water, Pentaerythrityl Tetrathylhexanoate, Propanediol, Panthenol, C10-30 Cholesterol/Lanosterol Esters, Sodium Acrylates Copolymer, Lecithin, Glycyrrhetinic Acid, Madecassoside, Asiaticoside, Phytic Acid, Caprylhydroxamic Acid, 1,2-Hexanediol.",https://www.sephora.com/product/minimalist-hydrating-moisturizer-with-pro-vitamin-b5-P506936,Moisturizer,"Brightening, Hydrating"
Soothe - ingrown hair oil,maude,$30.00 ,Size: 0.5 oz / 15 mL,"Carthamus Tinctorius (Safflower) Seed Oil, Vitis Vinifera (Grape) Seed Oil, Prunus Amygdalus Dulcis (Sweet Almond) Oil, Simmondsia Chinensis (Jojoba) Seed Oil, Ricinus Communis (Castor) Seed Oil, Chamomilla Recutita Flower Oil, Oenothera Biennis (Evening Primrose) Oil, Helianthus Annuus (Sunflower) Seed Oil, Tocopheryl Acetate, Melaleuca Alternifolia (Tea Tree) Leaf Oil, Lavandula Angustifolia (Lavender) Oil, Cymbopogon Flexuosus (Lemongrass) Oil, Farnesol, Linalool, Limonene.",https://www.sephora.com/product/maude-soothe-ingrown-hair-oil-P505693,Oil,
Shave - moisturizing shave oil,maude,$32.00 ,Size: 1 oz / 30 mL,"Helianthus Annuus (Sunflower) Seed Oil, Caprylic/Capric Triglyceride, Prunus Amygdalus Dulcis (Sweet Almond) Oil, Simmondsia Chinensis (Jojoba) Seed Oil, Limnanthes Alba (Meadowfoam) Seed Oil, Sesamum Indicum (Sesame) Seed Oil, Olea Europaea (Olive) Fruit Oil, Boswellia Carterii Oil, Citrus Aurantium Amara (Bitter Orange) Flower Oil, Juniperus Virginiana Oil, Citral, Eugenol, Benzyl Benzoate, Geraniol, Farnesol, Linalool, Limonene.",https://www.sephora.com/product/maude-shave-moisturizing-shave-oil-P505732,Oil,
The Uniform™ Tinted Mineral Sunscreen Broad Spectrum SPF 45,MERIT,$38.00 ,Color: 14 - medium-deep neutral,"-Zinc Oxide: For broad spectrum UVA/UVB protection. -Final Natural Powders: Visibly smooth and blur skin. -Lightweight Emollients: For a soft, velvety finish. Active Ingredients: Zinc Oxide 15.065% Inactive Ingredients: Water, Propanediol, C13-15 Alkane, Isoamyl Laurate, Butyloctyl Salicylate, Zea Mays (Corn) Starch, Polyglyceryl-4 Diisostearate/Polyhydroxystearate/Sebacate, C15-19 Alkane, Coco-Caprylate, Polyhydroxystearic Acid, Magnesium Sulfate, Diglycerin, Caprylic/Capric Triglyceride, Quaternium-90 Bentonite, Hydroxyacetophenone, Disteardimonium Hectorite, Lauroyl Lysine, Triethyl Citrate, Caprylyl Glycol, Tocopheryl Acetate, Sorbitan Isostearate, Cellulose, Ethylhexylglycerin, Polyglycerin-3, Polyglycerin-4, Glycerin, Tocopherol, Titanium Dioxide (CI 77891), Iron Oxides (CI 77491, CI 77492, CI 77499).",https://www.sephora.com/product/merit-the-uniform-tinted-mineral-spf-45-P516692,Other,Sunscreen
Cooling Water Jelly Ice Soothing Serum Stick with Niacinamide,MILK MAKEUP,$29.00 ,Size: 0.46 oz / 13 g,"-3% Niacinamide: Helps minimize the look of pores and redness and provides blue-light protection. -Aloe, Caffeine, and Seawater: Soothe, refresh, and reduce the look of puffiness. -Redness-Calming Complex: Defends against external stressors to soothes irritation. Aqua/Water/Eau, Aloe Barbadensis Leaf Juice, 2,3-Butanediol, Propanediol, Glycerin, Sorbitol, Niacinamide, Maris Aqua/Sea Water/Eau De Mer, Caffeine, Chondrus Crispus Extract, Tremella Fuciformis Polysaccharide, Hibiscus Rosa-Sinensis Flower Extract, Chlorella Ferment, Kappaphycus Alvarezii Extract, Hydroxyacetophenone, Tocopherol, Sodium Cocoyl Amino Acids, Sarcosine, Magnesium Aspartate, Potassium Aspartate, Sodium Hyaluronate, Sodium Hydroxide, Guar Hydroxypropyltrimonium Chloride, Agarose, 1,2-Hexanediol, Caprylyl Glycol, Sodium PCA, Propylene Glycol, Erythritol, Carrageenan, Ethylhexylglycerin, Xanthan Gum, Citric Acid, Sodium Carbonate, Benzoic Acid, Sorbic Acid, Sodium Benzoate, Potassium Sorbate, Phenoxyethanol, Blue 1 (CI 42090).",https://www.sephora.com/product/cooling-water-jelly-ice-soothing-serum-stick-with-niacinamide-P515188,Serum,Soothing
Collagen Protect® Vegan Creamer,Moon Juice,$32.00 ,Size: 4.5 oz/ 120 g,"-Silver Ear Mushroom: This extract is 100 percent fruiting body—no fillers, starch, grains, or mycelium. Its small molecular structure supports the skin barrier, hydrates, and is one of the only vegan sources of Vitamin D. -Tocos: These tocos (rice bran soluble) are extracted from Thai jasmine rice using patented technology to separate the bran from grain. Bioactive and rich in essential fatty and amino acids, they help protect collagen and prevent the visible signs of aging. -Hyaluronic Acid: Clinically shown to increase skin moisture and reduce the appearance of fine lines and wrinkles. It also supports natural collagen synthesis. Hyaluronic Acid, Streptococcus Equibacterial Extracellular Capsule / Acide Hyaluronique, Capsule Extracellulaire De Streptococcus Equibacterial 60 Mg, Oryza Sativa (Rice) 2:1 5:4g Seed Bran / Oryza Sativa (Riz) 2:1 5:4g De Son De Grains 2.7 G, Tremella Fuciformis (Mushroom) 1:1 1.2 G Fruiting Body / Tremella Fuciformis (Champignon Blanc) 1:1 1.2 G De Fructification 1.2 G.",https://www.sephora.com/product/moon-juice-collagen-protect-reg-vegan-creamer-P471265,Moisturizer,
Pure Argan Oil,Moroccanoil,$52.00 ,Size: 1.7 oz/ 50 mL,#NAME?,https://www.sephora.com/product/pure-argan-oil-P412114,Oil,
Lip Balm – Hydrating Argan Butter + Peptide Lip Treatment,Moroccanoil,$22.00 ,Color: Vanilla Date - Sheer pinky nude,"Phytosteryl/Isostearyl/Cetyl/Stearyl/Behenyl Dimer Dilinoleate, Polybutene, Triisostearyl Citrate, Argania Spinosa (Argan) Kernel Oil, Pentaerythrityl Tetraisostearate, Ricinus Communis (Castor) Seed Oil, Hydrogenated Argania Spinosa (Argan) Kernel Oil, Butyrospermum Parkii (Shea) Butter, Synthetic Wax, Disteardimonium Hectorite, Helianthus Annuus (Sunflower) Seed Wax, Glycine Soja (Soybean) Oil, Ethylhexyl Palmitate, Triethyl Citrate, Caprylic/Capric Triglyceride, Glyceryl Caprylate, Tribehenin, Sorbitan Olivate, Parfum/Fragrance, Vanillin, Tocopherol, Sorbitan Isostearate, Stearalkonium Hectorite, Polyhydroxystearic Acid, Propylene Carbonate, Sodium Hyaluronate, Palmitoyl Tripeptide-1, Caproic Acid, Palmitoyl Hexapeptide-12, CI 77891 (Titanium Dioxide), CI 77491 (Iron Oxide Red), CI 77499 (Iron Oxide Black), CI 15850 (Red 7). MOLBVD01.",https://www.sephora.com/product/lip-balm-hydrating-argan-peptide-lip-treatment-P520568,Serum,"Anti-Aging, Acne, Hydrating"
Body Polishing Scrub,Moroccanoil,$32.00 ,,"-Argan Oil: Hydrates and nourishes skin. -Argan Shell Powder and Lava Stone Pumice: Gently polish away dead skin cells. -Avocado, Rice Bran, Sweet Almond, Safflower, and Grapeseed Oils: Nourish and moisturize while supporting skin's natural defenses. Oryza Sativa (Rice) Bran Oil, Glycerin, Carthamus Tinctorius (Safflower) Seed Oil, Prunus Amygdalus Dulcis (Sweet Almond) Oil, Vitis Vinifera (Grape) Seed Oil, Ethylhexyl Palmitate, Isopropyl Palmitate, Polyglyceryl-10 Myristate, Persea Gratissima (Avocado) Oil, Argania Spinosa (Argan) Shell Powder, Pumice, Parfum/Fragrance, Argania Spinosa (Argan) Kernel Oil, Helianthus Annuus (Sunflower) Seed Oil, Caprylic/Capric Triglyceride, Styrene/Butadiene Copolymer, Tocopherol.",https://www.sephora.com/product/moroccanoil-body-polishing-scrub-P502662,Body,
InvisiScar Post-Acne Resurfacing Treatment,Murad,$39.00 ,Size: 0.5 oz/ 15 mL,"-Salicylic Acid Exfoliant: Visibly diminishes uneven scar texture and reveals a smoother complexion. -Purified TECA Centella asiatica (Asiaticoside, Madecassic Acid, and Asiatic Acid): Hydrates to support natural skin-barrier repair. -Hydroxytyrosol and Pure Vitamin C: Antioxidants that visibly brighten and reduce dark spots. Dimethicone, Polysilicone-11, Ascorbic Acid, Silica, Dimethicone/Divinyldimethicone/Silsesquioxane Crosspolymer, Dimethyl Isosorbide, Asiaticoside, Madecassic Acid, Asiatic Acid, Hexylresorcinol, Salicylic Acid, Acetyl Glucosamine, Hydroxytyrosol, Tocopheryl Acetate, Trimethylsiloxysilicate, Fragrance (Parfum), Limonene, Linalool, Titanium Dioxide (CI 77891).",https://www.sephora.com/product/invisiscar-resurfacing-treatment-P446423,Serum,"Acne, Exfoliating"
Rapid Relief Acne Spot Treatment,Murad,$27.00 ,Size: 0.5 oz/ 15 mL,"-Salicylic Acid 2%: Penetrates pores to exfoliate and visibly smooth the skin. -Oat Extract: Soothes the skin and reduces the look of redness. -Witch Hazel: Absorbs excess oil and visibly tightens pores. Salicylic Acid 2%, Water (Aqua), Alcohol, Hamamelis Virginiana (Witch Hazel) Water, Propanediol, Pentylene Glycol, Glycerin, Silica, Butylene Glycol, Polyacrylate Crosspolymer-6, C12-15 Alkyl Lactate, Aesculus Hippocastanum (Horse Chestnut) Seed Extract, Avena Sativa (Oat) Kernel Extract, Urea, Yeast Amino Acids, Trehalose, Inositol, Taurine, Betaine, Thymol, Terpineol, Hydroxyphenyl Propamidobenzoic Acid, Shea Butter Ethyl Esters, 4-T-Butylcyclohexanol, Disodium EDTA, Sodium Hydroxide.",https://www.sephora.com/product/rapid-relief-acne-spot-treatment-P421432,Serum,Acne
Renewing Eye Cream,Murad,$89.00 ,Size: 0.5 oz,"-Youth-building Peptides And Retinol: Support natural collagen and reduce the appearance of medium to deep wrinkles. -Phytoestrogens: Improve elasticity and help smooth skin. -Eye-Brightening Complex: Reduces dark circles and under-eye puffiness while illuminating the eye area. Water, Butylene Glycol, Tricaprylyl Citrate, Pentylene Glycol, Bis-Diglyceryl Polyacyladipate-2, Jojoba Esters, Glycerin, Boron Nitride, Caprylic/Capric/Myristic/Stearic Triglyceride, Cetyl Alcohol, Stearic Acid, Glyceryl Stearate, PEG-100 Stearate, Citrus Unshiu Peel Extract, Mangifera Indica (Mango) Seed Butter, Dimethicone, Cetyl Phosphate, Urea, Yeast Amino Acids, Trehalose, Inositol, Taurine, Betaine, Glycine Soja (Soybean) Seed Extract, Iris Florentina Root Extract, Dioscorea Villosa (Wild Yam) Root Extract, Glycine Soja (Soybean) Sterols, Trifolium Pratense (Clover) Flower Extract, Palmitoyl Oligopeptide, Palmitoyl Tetrapeptide-7, Retinol, Sodium Hyaluronate, Serenoa Serrulata Fruit Extract, Oenothera Biennis (Evening Primrose) Oil, Tocopherol, Ascorbyl Palmitate, Borago Officinalis Seed Oil, Dipeptide-2, Hesperidin Methyl Chalcone, Caprylic/Capric Triglyceride, Sodium PCA, Panthenol, Oleyl Alcohol, Steareth-20, Lecithin, Carbomer, Polysorbate 20, Sodium Potassium Aluminum Silicate, Aminomethyl Propanol, Disodium EDTA, Silica, Phenoxyethanol, Caprylyl Glycol, Chlorphenesin, Titanium Dioxide (CI 77891).",https://www.sephora.com/product/renewing-eye-cream-P107306,Moisturizer,
Retinol Youth Renewal Eye Serum,Murad,$89.00 ,Size: 0.5 oz/ 15 mL,"-Retinol Tri-Active Technology: Visibly fights lines and deep wrinkles, evens skin tone, and boosts radiance. -Swertia Flower Extract: Supports skin’s resilience for a firmer appearance. -Hyaluronic Acid: Hydrates to plump the look of skin and minimize dryness. Water/Aqua/Eau, Glycerin, Butylene Glycol, Imperata Cylindrica Root Extract, Dimethyl Isosorbide, Meadowfoam Delta-Lactone, Retinyl Propionate, Retinol, Swertia Chirata Extract, Urea, Yeast Amino Acids, Trehalose, Inositol, Taurine, Betaine, Fucus Vesiculosus Extract, Glycine Soja (Soybean) Extract, Macrocystis Pyrifera (Kelp) Extract, Isopropyl Palmitate, Lecithin, PVP, Hexylene Glycol, Capryl Glycol, Punica Granatum Seed Oil, Caprylic/Capric Triglyceride, PVM/MA Decadiene Crosspolymer, Xanthan Gum, Hydrolyzed Vegetable Protein, PEG-8, Carbomer, Sodium Bisulfite, Silica, Sodium Hydroxide, Chlorphenesin, Phenoxyethanol, Fragrance (Parfum), Titanium Dioxide (CI 77891), Synthetic Fluorphlogopite, Red 4 (CI 14700), Yellow 5 (CI 19140).",https://www.sephora.com/product/murad-retinol-youth-renewal-eye-serum-P453928,Serum,Anti-Aging
Rapid Dark Spot Correcting Serum with Glycolic and Tranexamic Acid,Murad,$84.00 ,Size: 1 oz/ 30 mL,"-Resorcinol and Tranexamic Acid: Help minimize the appearance of hyperpigmentation and uneven skin tone. -Glycolic Acid: Removes dulling surface cells to enhance radiance and ingredient performance. Water/Aqua/Eau, Alcohol Denat., Glycolic Acid, Butylene Glycol, Glycerin, Methyl Gluceth-20, Tranexamic Acid, 4-Ethylresorcinol, Hexapeptide-2, Rice Amino Acids, Urea, Yeast Amino Acids, Trehalose, Inositol, Taurine, Betaine, Zinc Gluconate, Dipotassium Glycyrrhizate, Allantoin, Hydroxyethylcellulose, Sodium Metabisulfite, Sodium Sulfite, Sodium Hydroxide, PPG-26-Buteth-26, PEG-40 Hydrogenated Castor Oil, Polyquaternium-4, Disodium EDTA, Limonene, Benzyl Salicylate, Linalool, Fragrance (Parfum).",https://www.sephora.com/product/murad-rapid-dark-spot-correcting-serum-P466673,Serum,"Brightening, Exfoliating"
Afterglow Moisturizing Lip Balm with Hyaluronic Acid,NARS,$30.00 ,Color: Orgasm - peachy pink with golden shimmer,"-Moisture-Locking Blend: Mango seed oil and shea butter lock in moisture while vitamin E softens. -Hyaluronic Acid Smoothing Spheres: Retain moisture for soft, smooth, and fuller-looking lips. Polyglyceryl-2 Triisostearate, Diisostearyl Malate, Glyceryl Diisostearate, Polyethylene, Hydrogenated Polyisobutene, Squalane, Triisostearin, Dimethicone, Butyrospermum Parkii (Shea) Butter, Ethylhexyl Palmitate, Lauroyl Lysine, Mangifera Indica (Mango) Seed Oil, Sorbitan Sesquiisostearate, Dimethicone Crosspolymer, Ethylhexylglycerin, Tribehenin, Cocos Nucifera (Coconut) Oil, Sorbitan Isostearate, Trihydroxystearin, Simethicone, Sodium Hyaluronate, Gardenia Taitensis Flower Extract, Glucomannan, Mica, Tocopherol, Lactic Acid, Palmitoyl Tripeptide-1, [+/- (May Contain/Peut Contenir): Titanium Dioxide (Ci 77891), Red 6 (Ci 15850), Red 7 Lake (Ci 15850), Yellow 5 Lake (Ci 19140), Iron Oxides (Ci 77491)].",https://www.sephora.com/product/afterglow-lip-balm-P519765,Lip Care,Hydrating
HY-GEN Bronze - Energizing & Hydrating Primer Serum,NATASHA DENONA,$48.00 ,Color: Universal Neutral Bronze,"-Hydroviton: Short term: Hydrates up to 72 hours; Long term: Boosts skin water regulation. -Symcontrol: Oil Control: Minimizes T-zone shine. -Hydrogenated Castor Oil: Unique hydration blend delivers a silky finish for supple, radiant skin. Aqua (Water/Eau), Isopentyldiol, Butylene Glycol, Glycerin, Synthetic Fluorphlogopite, Polyester-5, Polyacrylate Crosspolymer-11, Ppg-26-Buteth-26, Caprylyl Glycol, Propanediol, Peg-40 Hydrogenated Castor Oil, Phenoxyethanol, Polyglyceryl-10 Eicosanedioate/Tetradecanedioate, Ethylhexylglycerin, Hexylene Glycol, Parfum (Fragrance), Pentylene Glycol, Sodium Hyaluronate, Citric Acid, Fructose, Sodium Hydroxide, Urea, Potassium Hydroxide, Sodium Phosphate, Linalool, Allantoin, Maltose, Sodium Chloride, Sodium Lactate, Sodium Pca, Trehalose, Citronellol, Nonapeptide-1, Glucose, Tetraselmis Suecica Extract, Prunus Persica Fruit Extract (Prunus Persica (Peach) Fruit Extract), Tocopherol, Sodium Benzoate, Lactic Acid, Potassium Sorbate, Disodium Phosphate +/- May Contain Ci 77491 (Iron Oxides), Ci 77891 (Titanium Dioxide), Ci 77499 (Iron Oxides).",https://www.sephora.com/product/natasha-denona-hy-gen-bronze-energizing-hydrating-primer-serum-P516777,Serum,Hydrating
HY-GEN - Energizing & Hydrating Primer Serum,NATASHA DENONA,$48.00 ,Size: .67 oz / 20 mL,"-SYMCONTROL: Reduces shiny appearance of the T-zone and balances the sebum of the skin. -HYDROVITON: Restores skin’s capacity to retain water protects from evaporation and dryness. Aqua/Water/Eau, Isopentyldiol, Butylene Glycol, Glycerin, Polyester-5, Mica, Polyacrylate Crosspolymer-11, Ppg-26-Buteth-26, Caprylyl Glycol, Propanediol, Peg-40 Hydrogenated Castor Oil, Phenoxyethanol, Polyglyceryl-10 Eicosanedioate / Tetradecanedioate, Silica, Ethylhexylglycerin, Hexylene Glycol, Parfum/Fragrance, Sodium Hyaluronate, Potassium Hydroxide, Sodium Phosphate, Linalool, Sodium Acetate, Citronellol, Nonapeptide-1, Pentylene Glycol, Citric Acid, Fructose, Sodium Hydroxide, Tetraselmis Suecica Extract, Urea, Prunus Persica Fruit Extract, Allantoin,Maltose, Sodium Benzoate, Sodium Chloride, Sodium Lactate, Sodium Pca, Trehalose, Lactic Acid, Potassium Sorbate, Glucose, Disodium Phosphate +/- Ci 77891 / Titanium Dioxide.",https://www.sephora.com/product/hy-gen-skin-glass-energizing-hydrating-primer-serum-P500263,Serum,Hydrating
Skin Warrior™ Moisture Rescue Cream,Naturally Serious,$35.00 ,Size: 1.7 oz / 50 mL,"-Magnolia and Mangosteen: Reduce visible signs of aging due to environmental damage. -Hyaluronic Acid and Squalane: Increase hydration to save skin from dryness. -Colloidal Oatmeal, Ceramide, and Shea Butter: Lock in hydration and provide a protective layer of moisture. Water/Aqua/Eau, Butyrospermum Parkii (Shea) Butter, Glycerin, Pyrus Malus (Apple) Fruit Extract, Simmondsia Chinensis (Jojoba) Seed Oil, Polyglyceryl-3 Stearate, Jojoba Esters, Undecane, Cetyl Alcohol, Caprylic/Capric Triglyceride, Propanediol, Tridecane, Bisabolol, Squalane, Pentylene Glycol, Colloidal Oatmeal, Garcinia Mangostana Peel Extract, Theobroma Cacao (Cocoa) Seed Butter, Caffeine, Aspalathus Linearis Leaf Extract, Lycium Barbarum Fruit Extract, Punica Granatum Extract, Vitis Vinifera (Grape) Seed Extract, Betula Alba Bark Extract, Magnolia Officinalis Bark Extract, Cera Alba (Beeswax), Ceramide NP, Coleus Barbatus Root Extract, Leuconostoc/Radish Root Ferment Filtrate, Sodium Hyaluronate, Leontopodium Alpinum Extract, Peucedanum Ostruthium Leaf Extract, Pinus Strobus Bark Extract, Camellia Sinensis Leaf Extract, Tocopherol, Helianthus Annuus (Sunflower) Seed Oil, Hydrogenated Vegetable Glycerides, Tocopheryl Acetate, Allantoin, Citric Acid, Sodium Phytate, Xanthan Gum, Sodium Stearoyl Lactylate, Phenethyl Alcohol, Maltodextrin, Cetearyl Alcohol, Limonene, Linalool, Citral, Citronellol, Geraniol, Fragrance/Parfum*. *100% natural source.",https://www.sephora.com/product/skin-warrior-anti-pollution-repair-cream-P433971,Moisturizer,Hydrating
