name,brand,price,size1,ingredients,url,category,subcategory
Alpha Beta® Extra Strength Daily Peel Pads,Dr. Dennis Gross Skincare,$92.00 ,Size: 30 Treatments + 5 Bonus,"-Glycolic Acid (AHA) and Mandelic Acid (AHA): Visibly reduces lines and wrinkles and balances skin. -Salicylic Acid (BHA): Clears clogged pores. -Resveratrol and Green Tea Extract: Supports skin cell lifespan and protects against free radicals. Step 1: Water/Aqua/Eau, Alcohol Denat. (SD Alcohol 40-B), Glycolic Acid, Potassium Hydroxide, Hamamelis Virginiana (Witch Hazel) Water, Salicylic Acid*, Polysorbate 20, Lactic Acid, Mandelic Acid, Malic Acid, Citric Acid, Salix Alba (Willow) Bark Extract, Camellia Sinensis Leaf Extract, Achillea Millefolium Extract, Chamomilla Recutita (Matricaria) Flower Extract, Soy Isoflavones, Anthemis Nobilis Flower Extract, Glycerin, Copper PCA, Zinc PCA, Lecithin, Alcohol, Polysorbate 80, Disodium EDTA, Menthone Glycerin Acetal, Fragrance (Parfum), Phenoxyethanol, Benzoic Acid, Sodium Benzoate, Potassium Sorbate (* - exfoliant) Step 2: Water/Aqua/Eau, Sodium Bicarbonate, Resveratrol, Retinol, Ascorbic Acid, Ubiquinone, Phospholipids, Adenosine, Tocopheryl Acetate, Soy Isoflavones, Achillea Millefolium Extract, Camellia Sinensis Leaf Extract, Leuconostoc/Radish Root Ferment Filtrate, Copper PCA, Sodium PCA, Zinc PCA, Glycerin, Polysorbate 20, Octoxynol-9, Tetrasodium EDTA, Phenoxyethanol, Sodium Benzoate, Potassium Sorbate. .",https://www.sephora.com/product/alpha-beta-peel-extra-strength-daily-peel-P269122,Exfoliator,Exfoliating
Brightening Derm Revival Mask,SK-II,$170.00 ,Size: 10 Masks,"-PITERA™: SK-II's signature ingredient that supports skin’s natural regeneration. -Niacinamide (Vitamin B3): Visibly evens skin tone and reduces the appearance of hyperpigmentation. -Vitamin C: A powerful antioxidant to brighten and improve skin's overall complexion. Water, Galactomyces Ferment Filtrate*, Butylene Glycol, Niacinamide, Glycerin, Pentylene Glycol, Ascorbyl Glucoside, Inositol, Sodium Hydroxide, Acrylates/C10-30 Alkyl Acrylate Crosspolymer, Benzyl Alcohol, Methylparaben, Disodium EDTA, Yeast Extract. *PITERA™.",https://www.sephora.com/product/brightening-derm-revival-mask-P375864,Face Mask,Brightening
First Care Activating Serum Sheet Mask,Sulwhasoo,$12.00 ,Size: 1 mask,"-Sulwhasoo Master Complex™: A combination of herbal ingredients and ginseng that helps activate the skin’s potential and strengthen the natural barrier. Water/Aqua/Eau, Butylene Glycol, Propanediol, Glycerin, Betaine, 1,2-Hexanediol, Glyceryl Polymethcrylate, Carbomer, Tromethamine, Ppg-13-Decyltetradeceth-24,Scutellaria Baicalensis Root Extract, Ethylhexylglycerin, Adenosine, Fragrance/Parfum, Limonene, Disodium Ed-Ta, Xanathan Gum, Cellulose Gum, Dextrin, Theobroma Cacao (Cocoa) Extract, Honey/Mel/Miel, Madecassoside, Rehmannia Glu-Tinosa Root Extract, Dipotassium Glycyrrhizate, 3-0-Ethylascorbic Acid, Taurine, Ophiopogon Japonicus Root Extract, Paeonia Lactiflora Root Extract, Lilium Candidum Bulb Extract, Polygonatum Odoratum Rhizome Extract, Biosaccharide Gum-1, Panax Ginseng Root Extract, Pentylene Glycol, Linalool, Nelumbo Nucifera Flower Extract, Natto Gum, Ziziphus Jujuba Fruit Extract, Juglans Regia (Walnut) Seed Extract, Prunus Mume Extract, Citronellol, Tocopherol.",https://www.sephora.com/product/first-care-activating-serum-sheet-mask-P508279,Serum,
Hydrating Hyaluronic Acid Face Masks,SEPHORA COLLECTION,$6.00 ,Color: Coconut,"-Hyaluronic Acid: For quick and lasting hydration. Aqua (Water), Butylene Glycol, Polyglyceryl-6 Stearate, Cocos Nucifera (Coconut) Fruit Extract, Glycerin, 1,2-Hexanediol, Hydroxyacetophenone, Cetearyl Alcohol, Hydrogenated Ethylhexyl Olivate, Citrullus Lanatus (Watermelon) Fruit Extract, Polyglyceryl-6 Behenate, Parfum (Fragrance), Sodium Polyacrylate, Tocopherol, Helianthus Annuus (Sunflower) Seed Oil, Sorbitan Caprylate, Glycolipids, Lecithin, Xanthan Gum, Sodium Hyaluronate, Hydrogenated Olive Oil Unsaponifiables, Cocos Nucifera (Coconut) Oil, O-Cymen-5-Ol, Gardenia Taitensis Flower. .",https://www.sephora.com/product/sephora-collection-face-masks-fruit-plant-extracts-hydrating-hyaluronic-acid-P505336,Face Mask,Hydrating
Water Drench Broad Spectrum SPF 45 Hyaluronic Sheer Tint Moisturizer,Peter Thomas Roth,$25.00 ,Size: .67 fl oz/20 ml,"-Broad Spectrum SPF 45: Shields skin from aging UVA/UVB rays without oxybenzone or octinoxate. Avobenzone 3%, Homosalate 5%, Octisalate 5%, Octocrylene 10%, Water/Aqua/Eau, Dimethicone, Glycerin, Dipropylene Glycol, Polymethylsilsesquioxane, Argania Spinosa Kernel Oil, Tocopheryl Acetate, Dimethicone/PEG-10/15 Crosspolymer, Phenoxyethanol, Titanium Dioxide/CI 77891, Lauryl PEG-9 Polydimethylsiloxyethyl Dimethicone, Saccharide Isomerate, Isododecane, Methyl Gluceth-20, Coco-Caprylate/Caprate, Bisabolol, Sodium Chloride, Sodium Hyaluronate, PEG-15/Lauryl Dimethicone Crosspolymer, Sodium PCA, Polyglyceryl-6 Polyricinoleate, Polyhydroxystearic Acid, Iron Oxides/CI 77492, Iron Oxides/CI 77491, Iron Oxides/CI 77499, Yeast Extract, Dilinoleic Acid/Butanediol Copolymer, Disodium Stearoyl Glutamate Trisiloxane, Propylene Glycol, Ceteareth-25, Potassium Sorbate, Sodium Benzoate, Castor Oil/IPDI Copolymer, Sodium Citrate, Citric Acid, Cetyl Alcohol, Ethylhexylglycerin, Saccharomyces/Magnesium Ferment, Sambucus Nigra Fruit Extract, Behenic Acid, Ceramide NP, Cholesterol, Mica, Ceramide NS, Saccharomyces/Iron Ferment, Saccharomyces/Copper Ferment, Saccharomyces/Silicon Ferment, Saccharomyces/Zinc Ferment, Butylene Glycol, Ceramide AP, Ceramide EOP, Ceramide EOS, Tocopherol, Olea Europaea (Olive) Leaf Extract, Caprooyl Phytosphingosine, Caprooyl Sphingosine.-Hyaluronic Acid: A potent hydrator that drenches skin with moisture and draws in water. -Pentavitin: Helps provide hydration for up to 72 hours, even after cleansing. -Broad Spectrum SPF 45: Shields skin from aging UVA/UVB rays without oxybenzone or octinoxate. Water Drench® Hyaluronic Cloud Cream Hydrating Moisturizer: Water/Aqua/Eau, Dimethicone, Glycerin, Dipropylene Glycol, Dimethicone/PEG-10/15 Crosspolymer, Sodium Hyaluronate, Yeast Extract, Ceramide AP, Ceramide EOP, Ceramide EOS, Ceramide NP, Ceramide NS, Sambucus Nigra Fruit Extract, Sodium PCA, Tocopherol, Saccharide Isomerate, Caprooyl Phytosphingosine, Caprooyl Sphingosine, Saccharomyces/Iron Ferment, Saccharomyces/Copper Ferment, Saccharomyces/Silicon Ferment, Saccharomyces/Magnesium Ferment, Saccharomyces/Zinc Ferment, Olea Europaea (Olive) Leaf Extract, Cholesterol, Citric Acid, Sodium Citrate, Methyl Gluceth-20, Sodium Chloride, Trisiloxane, Propylene Glycol, Ceteareth-25, Potassium Sorbate, Sodium Benzoate, Behenic Acid, Butylene Glycol, Lauryl PEG-9 Polydimethylsiloxyethyl Dimethicone, Cetyl Alcohol, Ethylhexylglycerin, Mica, Phenoxyethanol. Water Drench® Broad Spectrum SPF 45 Hyaluronic Cloud Moisturizer: Avobenzone 3%, Homosalate 5%, Octisalate 5%, Octocrylene 10%, Water/Aqua/Eau, Polymethylsilsesquioxane, Glycerin, Dipropylene Glycol, Dimethicone, Argania Spinosa Kernel Oil, Tocopheryl Acetate, Yeast Extract, Cyclopentasiloxane, Cyclohexasiloxane, Phenoxyethanol, Lauryl PEG-9 Polydimethylsiloxyethyl Dimethicone, Isododecane, Dimethicone/PEG-10/15 Crosspolymer, Saccharide Isomerate, Methyl Gluceth-20, Sodium Chloride, Sodium Hyaluronate, Bisabolol, PEG-15/Lauryl Dimethicone Crosspolymer, Sodium PCA, Propylene Glycol, Ceteareth-25, Sodium Benzoate, Potassium Sorbate, Sodium Citrate, Citric Acid, Sambucus Nigra Fruit Extract, Cetyl Alcohol, Saccharomyces/Magnesium Ferment, Hydrolyzed Silk, Behenic Acid, Ceramide NP, Cholesterol, Ethylhexylglycerin, Tocopherol, Ceramide NS, Saccharomyces/Iron Ferment, Saccharomyces/Copper Ferment, Saccharomyces/Silicon Ferment, Saccharomyces/Zinc Ferment, Butylene Glycol, Ceramide AP, Ceramide EOP, Ceramide EOS, Olea Europaea (Olive) Leaf Extract, Caprooyl Phytosphingosine, Caprooyl Sphingosine, Disodium EDTA, Ascorbyl Palmitate, Mica (CI 77019). Water Drench® Hyaluronic Cloud Hydra-Gel Eye Patches: Water/Aqua/Eau, Glycerin, Butylene Glycol, Sodium Hyaluronate, Hydrolyzed Collagen, Caffeine, Ceramide NP, Arnica Montana Flower Extract, Althaea Officinalis Root Extract, Allantoin, Tocopherol, Hydrolyzed Sodium Hyaluronate, Butyrospermum Parkii (Shea) Butter, Glycyrrhiza Glabra (Licorice) Root Extract, Scutellaria Baicalensis Root Extract, Angelica Gigas Root Extract, Cimicifuga Racemosa Root Extract, Morus Alba Bark Extract, Paeonia Lactiflora Root Extract, Phellinus Linteus Extract, Polygonum Multiflorum Root Extract, Sesamum Indicum (Sesame) Seed Extract, Sophora Angustifolia Root Extract, Aloe Barbadensis Leaf Juice, Ricinus Communis (Castor) Seed Oil, Amorphophallus Konjac Root Powder, Carrageenan, Hydroxyacetophenone, Hexylene Glycol, Propanediol, Xylitylglucoside, Sucrose, Anhydroxylitol, Glyceryl Caprylate, Xylitol, Betaine, Ethylhexylglycerin, Glucose, Lecithin, Maltodextrin, Magnesium Aspartate, Zinc Gluconate, Aluminum Hydroxide, Copper Gluconate, PEG-60 Hydrogenated Castor Oil, Gellan Gum, Cyamopsis Tetragonoloba (Guar) Gum, Ceratonia Siliqua Gum, Calcium Chloride, Tin Oxide, Synthetic Fluorphlogopite, Bis(Glycidoxyphenyl)Propane/Bisaminomethylnorbornane Copolymer, Caprylhydroxamic Acid, Disodium EDTA, 1,2-Hexanediol, Ethyl Hexanediol Chlorphenesin, Phenoxyethanol, Mica, Blue 1 (CI 42090), Titanium Dioxide (CI 77891), Iron Oxides (CI 77491).)",https://www.sephora.com/product/water-drench-broad-spectrum-spf-45-hyaluronic-sheer-tint-moisturizer-P516481,Moisturizer,"Sunscreen, Hydrating"
Pure Radiant Tinted Moisturizer Broad Spectrum SPF 30,NARS,$50.00 ,"Color: St. Moritz - M1 - medium with warm undertones, and a golden tone","Water, Dimethicone, Ethylhexyl Methoxycinnamate, Titanium Dioxide, Butylene Glycol, Propanediol, Diethylhexyl Succinate, Glycerin, Nylon-12, Cyclomethicone, Peg-9 Polydimethylsiloxyethyl Dimethicone, Peg-10 Dimethicone, Aluminum Hydroxide, Diphenylsiloxy Phenyl Trimethicone, Disteardimonium Hectorite, Sorbitan Sesquiisostearate, Stearic Acid Phenoxyethanol, Polymethylsilsesquioxane, Fragrance, Dimethicone/Vinyl, Dimethicone Crosspolymer, Trisodium, Edta, Aluminum Distearate, Talc, Ascorbyl Glucoside, Polysilicone-2, Vibrio Alginolyticus Ferment Filtrate, Tocopherol, Alteromonas Ferment Filtrate, Maris Sal (Sea Salt), Hydrogen Dimethicone, Bht, Algae (Algae Extract), Sodium Metabisulfite, Curcuma Longa [Curcuma Longa (Turmeric) Root Extract], Potassium Sorbate, Geraniol, Limonene, Citral, Linalool [+/- (May Contain): Ci 77891 (Titanium Dioxide), Ci 77491 (Iron Oxides), Ci 77492 (Iron Oxides), Ci 77499 (Iron Oxides)].",https://www.sephora.com/product/pure-radiant-tinted-moisturizer-spf-30-pa-P302923,Moisturizer,Sunscreen
Skin Glow SPF 30 Tinted Sunscreen Primer with Niacinamide,YSE Beauty,$54.00 ,Size: 1.7 oz/50 mL,"-Chemical SPF 30: Provides protection against harmful UVA and UVB rays. -Niacinamide: Improves the appearance of dark spots while boosting hydration. -Sodium Hyaluronate: Hydrates and promotes plump-, supple-looking skin. Water, Propanediol, Butyloctyl Salicylate, Cetearyl Alcohol, Polymethylsilsesquioxane, Dimethicone, Dicaprylyl Carbonate, Bismuth Oxychloride (Ci 77163), Glyceryl Stearate, Jojoba Esters, Sodium Stearoyl Glutamate, Phenoxyethanol, Dimethicone Crosspolymer, Mica, Ethylhexyl Hydroxystearate, Xanthan Gum, Iron Oxides (Ci 77491, Ci 77492, Ci 77499), Helianthus Annus (Sunflower) Seed Wax, Oryza Sativa (Rice) Bran Extract, Chlorphenesin, Acrylates/C10-30 Alkyl Acrylate Crosspolymer, Caprylyl Glycol, Niacinamide, Titanium Dioxide (Ci 77891), Ethylhexylglycerin, Hexylene Glycol, Stearyl Glycyrrhetinate, Tetrasodium Glutamate Diacetate, Helianthus Annuus (Sunflower) Extract Sucrose Glycyrrhiza Glabra (Licorice) Root Extract Sodium Hydroxide Polyglycerin-3 Tocopherol Rosmarinus Officinalis (Rosemary) Leaf Extract, Spirulina Maxima Extract, Sodium Hyaluronate, Lecithin, Avobenzone, Homosalate, Octisalate, Octocrylene.",https://www.sephora.com/product/yse-beauty-skin-glow-spf-30-primer-with-niacinamide-P517101,Other,Sunscreen
Aqua Bomb Korean Glow Sunstick SPF 50+,belif,$28.00 ,Size: .63 oz/18 g,"-Multi-7 Hyaluronic Acid: Hydrates, locks in moisture, and visibly firms. -Niacinamide: Known to visibly brighten and smooth texture. Octyldodecanol, C12-15 Alkyl Benzoate, Homosalate, Caprylic/Capric Triglyceride, Dicaprylyl Carbonate, Propylheptyl Caprylate, Octocrylene, Dibutyl Lauroyl Glutamide, Ethylhexyl Salicylate, Butyloctyl Salicylate, Dibutyl Ethylhexanoyl Glutamide, Butyl Methoxydibenzoylmethane, Pelargonium Graveolens Flower Oil (Fragrances of Botanical Origin), Citrus Aurantium Dulcis (Orange) Peel Oil (Fragrances of Botanical Origin), Hyaluronic Acid (Multi-7 Hyaluronic Acid) Hydrolyzed Hyaluronic Acid (Multi-7 Hyaluronic Acid), Sodium Hyaluronate (Multi-7 Hyaluronic Acid), Melissa Officinalis Flower/Leaf/Stem Water (belif Original Formula), Rosmarinus Officinalis (Rosemary) Leaf Water (belif Original Formula), Eucalyptus Globulus Leaf Extract (belif Original Formula), Laminaria Japonica Extract (Jeju-Haeyun Complex), Ecklonia Cava Extract (Jeju-Haeyun Complex), Hizikia Fusiforme Extract (Jeju-Haeyun Complex), Mentha Rotundifolia Leaf Extract (belif Original Formula), Rosa Canina Fruit Extract (belif Original Formula), Thymus Vulgaris (Thyme) Leaf Extract (belif Original Formula), Dextrin Palmitate, Polyhydroxystearic Acid, Stearalkonium Hectorite, Propylene Carbonate, Synthetic Fluorphlogopite, Tocopherol, Water, Hydrolyzed Sodium Hyaluronate (Multi-7 Hyaluronic Acid), Hydroxypropyltrimonium Hyaluronate (Multi-7 Hyaluronic Acid), Niacinamide, Sodium Acetylated Hyaluronate (Multi-7 Hyaluronic Acid), Butylene Glycol, 1,2-Hexanediol, Pentylene Glycol, Ethylhexylglycerin, Sodium Hyaluronate Crosspolymer (Multi-7 Hyaluronic Acid), Limonene (Fragrances of Botanical Origin), Citronellol (Fragrances of Botanical Origin), Geraniol (Fragrances of Botanical Origin), Linalool (Fragrances of Botanical Origin), Citral (Fragrances of Botanical Origin), Iron Oxides (CI 77491).",https://www.sephora.com/product/aqua-bomb-korean-glow-sunstick-spf-50-P516440,Other,Sunscreen
Daily UV Defense Invisible Korean Broad Spectrum SPF 36 Sunscreen,innisfree,$18.00 ,Size: 1.69 oz / 50 ml,"Active Ingredients: Avobenzone (2.5%), Homosalate (7.0%), Octisalate (4.3%) Inactive Ingredients: Water / Aqua / Eau, Homosalate, Butyloctyl Salicylate, Ethylhexyl Salicylate, Butylene Glycol, Ethylhexyl Methoxycrylene, Butyl Methoxydibenzoylmethane, Arachidyl Alcohol, Behenyl Alcohol, Polymethylsilsesquioxane, 1,2-Hexanediol, Cetyl Alcohol, Arachidyl Glucoside, Phenoxyethanol, Propanediol, Polyacrylate Crosspolymer-6, Octyldodecanol, Glyceryl Stearate, PEG-100 Stearate, Fragrance / Parfum, Xanthan Gum, Limonene, Centella Asiatica Extract, Portulaca Oleracea Extract, Echium Plantagineum Seed Oil, T-Butyl Alcohol, Camellia Sinensis Leaf Extract, Linalool, Ethylhexylglycerin, Helianthus Annuus (Sunflower) Seed Oil Unsaponifiables, Cardiospermum Halicacabum Flower/Leaf/Vine Extract, Tocopherol, Helianthus Annuus (Sunflower) Seed Oil, Glycerin, Hamamelis Virginiana (Witch Hazel) Leaf Extract, Citrus Unshiu Peel Extract, Opuntia Coccinellifera Fruit Extract, Orchid Extract, Camellia Japonica Leaf Extract, Citric Acid, Sodium Benzoate, Potassium Sorbate",https://www.sephora.com/product/innisfree-daily-uv-defense-sunscreen-spf-36-P456392,Other,Sunscreen
Every Sun Day™ Mineral Korean Sunscreen SPF 50+,Dr. Jart+,$40.00 ,Size: 1.69 oz / 50 mL,"-Zinc Oxide and Titanium Dioxide: Create a physical barrier to protect skin from UV rays. Water, Cyclopentasiloxane, Zinc Oxide, Propanediol, Titanium Dioxide, Butylene Glycol Dicaprylate/Dicaprate, Lauryl Polyglyceryl-3 Polydimethylsiloxyethyl Dimethicone, Methyl Methacrylate Crosspolymer, Butyloctyl Salicylate, Caprylyl Methicone, Citrus Aurantium Dulcis (Orange) Oil, Citrus Nobilis (Mandarin Orange) Peel Oil, Litsea Cubeba Fruit Oil, 1,2-Hexanediol, Disteardimonium Hectorite, Magnesium Sulfate, Stearic Acid, Aluminum Hydroxide, Polyglyceryl-3 Polydimethylsiloxyethyl Dimethicone, Triethoxycaprylylsilane, Sorbitan Caprylate, Glyceryl Caprylate, Ethylhexylglycerin, Tocopherol.",https://www.sephora.com/product/dr-jart-every-sun-day-mineral-sunscreen-spf-50-P457521,Other,Sunscreen
Dynamic Gentle Resurfacing Enzyme Cleanser,Elemis,$57.00 ,Size: 6.76 oz / 200 ml,"-Patented Tri-Enzyme Technology: Effectively breaks up the accumulation of dead skin cells. -Babassu Oil: Rich in lauric and myristic acid, this conditions skin. -White Truffle: Soothes and supports the natural microflora of the skin. Aqua/Water/Eau, Sodium Lauroyl Sarcosinate, Glycerin, Cocamidopropyl Betaine, Acrylates Copolymer, Polysorbate 20, Coco-Glucoside, Glycol Distearate, Glyceryl Oleate, Sodium Lactate, Dicaprylyl Ether, Phenoxyethanol, Lauryl Alcohol, Fragrance (Parfum), Sodium Chloride, Orbignya Oleifera (Babassu) Seed Oil, Xanthan Gum, Sodium Hydroxide, Caprylyl Glycol, Citric Acid, Propylene Glycol, Chlorphenesin, Glyceryl Stearate, Galactoarabinan*, Papain, Disodium EDTA, Behenyl Alcohol, Butyrospermum Parkii (Shea) Butter, Benzoic Acid, Moringa Pterygosperma Seed Extract, Hydrogenated Castor Oil, Disodium Phosphate, Stearyl Alcohol, Protease, Subtilisin, Tocopheryl Acetate (Vitamin E), Hydrogenated Palm Glycerides Citrate, Tocopherol, Poria Cocos Extract. *Extracted from larch tree.",https://www.sephora.com/product/elemis-dynamic-gentle-resurfacing-enzyme-cleanser-P510313,Cleanser,Exfoliating
Mini Hydrating Cream-To-Milk Cleanser with Hyaluronic Acid,The INKEY List,$7.00 ,Size: 1.69 oz/50 ml,"-Rice Milk 5%: Softens and supports skin’s barrier. -Hyaluronic Acid: Hydrates immediately and for up to 24 hours. Aqua (Water), Glycerin, Ethylhexyl Palmitate, C12-15 Alkyl Benzoate, PEG-6 Caprylic/Capric Glycerides, Betaine, Polyglyceryl-3 Dicitrate/Stearate, Sodium Acrylate/Sodium Acryloyldimethyl Taurate Copolymer, Isohexadecane, Pentylene Glycol, Propanediol, Butyrospermum Parkii (Shea) Butter, Hydroxyacetophenone, Oryza Sativa (Rice Starch), Caprylyl Glycol, Cetearyl Olivate, Polysorbate 80, Sorbitan Olivate, Ethylhexylglycerin, Sodium Hydroxide, Sorbitan Oleate, Xanthan Gum, Hydrolyzed Rice Protein, Oryza Sativa (Rice) Bran Oil, Inulin, Polyquaternium-10, Hydrolyzed Sodium Hyaluronate, Sodium Hyaluronate, Phenoxyethanol, Lecithin.",https://www.sephora.com/product/mini-hydrating-cream-to-milk-cleanser-with-hyaluronic-acid-P517119,Cleanser,Hydrating
Superfood Gentle Antioxidant Refillable Cleanser,Youth To The People,$39.00 ,Size: 8 oz / 237 ml,"Water/Aqua/Eau, Cocamidopropyl Hydroxysultaine, Sodium Cocoyl Glutamate, Sorbeth-230 Tetraoleate, Polysorbate 20, Sodium Chloride, Aloe Barbadensis Leaf (Aloe Vera) Juice Powder, Brassica Oleracea Acephala (Kale) Leaf Extract, Spinacia Oleracea (Spinach) Leaf Extract, Camellia Sinensis (Green Tea) Leaf Extract, Medicago Sativa (Alfalfa) Extract, Chamomilla Recutita (Matricaria) Flower Extract, Tetrahexyldecyl Ascorbate (Vitamin C), Glycerin, Panthenol (Vitamin B5), Tocopheryl Acetate (Vitamin E), Decyl Glucoside, Sorbitan Laurate, Tetrasodium Glutamate Diacetate, Gluconolactone, Ethylhexylglycerin, Maltodextrin, Citric Acid, Phenoxyethanol, Potassium Sorbate, Sodium Benzoate, Gardenia Jasminoides (Jasmine) Fruit Extract, Fragrance/Parfum, Sodium Hydroxide, Sodium Glycolate, Sodium Formate, Hexyl Cinnamal, Linalool, Limonene, Chlorophyllin-Copper Complex (CI 75810). .",https://www.sephora.com/product/kale-spinach-green-tea-age-prevention-cleanser-P411387,Cleanser,
barrier+ Ceramide + Ectoin Hydrating Gentle Gel Cleanser,Skinfix,$30.00 ,Size: 5 oz / 148 ml,"-Patented B-L3™ Complex: The first biomimetic compound to deliver intense repair to the moisture barrier. -Ectoin: Binds to lipids on skin to keep them in place and protect them from cleansing. -Chamomile: Calms and soothes dry skin after cleansing. Aqua/Water/Eau, Glycerin, Sodium Cocoyl Isethionate, Cocamidopropyl Hydroxysultaine, Sodium Lauroyl Methyl Isethionate, Sodium Methyl Cocoyl Taurate, Cocamidopropyl Betaine, Sodium Methyl Oleoyl Taurate, Lauryl Glucoside, Coco-Glucoside, Coconut Acid, Jojoba Oil/Macadamia Seed Oil Esters, Sodium Chloride, Sodium Isethionate, Ectoin, Squalene, Oligopeptide-1, Oligopeptide-2, Oligopeptide-3, Hexapeptide-11, Ceramide EOP, Propanediol, Hydroxyectoin, Niacinamide, Amylopectin, Bacillus/Soybean Fermert Extract, Folic Acid, Sodium Hyaluronate, Pentylene Glycol, Inulin, Phytosteryl Macadamiate, Lecithin, Acetyl Glutamine, Chamomilla Recutita (Matricaria) Flower Extract, Lithothamnion Calcareum Extract, Lactic Acid, Phytosterols, Alpha-Glucan Oligosaccharide, Sodium Lauroyl Lactylate, Tocopherol, Sodium Benzoate, Caprylyl Glycol, Polyglutamic Acid, Ceramide NP, Ceramide AP, Phytosphingosine, Cholesterol, Carbomer, Citric Acid, Xanthan Gum, Potassium Sorbate, Ethylhexylglycerin, Phenoxyethanol.",https://www.sephora.com/product/skinfix-barrier-ceramide-ectoin-hydrating-gentle-gel-cleanser-P511490,Cleanser,"Hydrating, Soothing"
Green Plum Refreshing Cleanser for Gentle Daily Wash,Beauty of Joseon,$13.00 ,Size: 3.38 oz/100 mL,"-Plum Water: Softens old, dead skins cells and moisturizes. -Mung Bean Seed Extract: Helps to keep skin moist for a long time by promoting moisture. Water, Prunus Mume Fruit Water, Cocamidopropyl Hydroxysultaine, Phaseolus Radiatus Seed Extract, Sodium Cocoyl Isethionate, Glycerin, Sodium Chloride, Camellia Sinensis Leaf Extract, Houttuynia Cordata Extract, Nelumbo Nucifera Flower Extract, Oryza Sativa (Rice) Extract, Prunus Mume Fruit Extract, Vaccinium Angustifolium (Blueberry) Fruit Extract, Guar Hydroxypropyltrimonium Chloride, Coconut Acid, Ethylhexylglycerin, Caprylyl Glycol, Sodium Isethionate, Citric Acid, Butylene Glycol, 1,2-hexanediol, Hydroxyacetophenone, Dextrin, Melia Azadirachta Leaf Extract, Melia Azadirachta Flower Extract, Gardenia Florida Fruit Extract, Propylene Glycol Laurate, Sodium Citrate, Disodium EDTA.",https://www.sephora.com/product/green-plum-refreshing-cleanser-P517670,Cleanser,
Plasma Wash Moisture-Depositing Gel Cream Cleanser with Glycerin,Experiment,$22.00 ,Size: 5 oz/150 ml,"-Castoryl Maleate: A moisture-depositing compound that helps glycerin stick during rinse-off. -15% Glycerin: A gold-standard hydrator that defends against irritation. -Fatty Acids: Replenish essential lipids for soft skin after rinse-off. Water, Glycerin, Cocamidopropyl Hydroxysultaine, Acrylates Crosspolymer-4, Sodium Cocoyl Glycinate, Sodium Lauroamphoacetate, Stearic Acid, Simmondsia Chinensis (Jojoba) Seed Oil, Sodium Chloride, Castoryl Maleate, Phenoxyethanol, Citric Acid, Stearyl Alcohol, Lauric Acid, Disodium EDTA, Methylparaben, Palmitic Acid, Ethylparaben, Malachite Extract, Oleic Acid, Propylene Glycol, Cetyl Alcohol, Sodium Hydroxide, Cyanocobalamin.",https://www.sephora.com/product/plasma-wash-moisture-depositing-gel-cream-cleanser-P518189,Cleanser,Hydrating
Vinoclean Gentle Cleansing Almond Milk,Caudalie,$30.00 ,Size: 6.7 oz/ 200 mL,"-Sweet Almond Oil and Castor Oil: Nourish, visibly soften, and soothe while enhancing lash length. -Cornflower Water: Soothes. -Polyphenols: Provide antioxidant-rich hydration. Aqua/Water/Eau, Isopropyl Isostearate, Butylene Glycol, Glycerin, Cetyl Alcohol, Prunus Amygdalus Dulcis (Sweet Almond) Oil, Ricinus Communis (Castor) Seed Oil, Simmondsia Chinensis (Jojoba) Seed Oil, Palmitoyl Grape Seed Extract, Sodium Cocoyl Glutamate, Carbomer, Decyl Glucoside, Butyrospermum Parkii (Shea) Butter Extract, Maltodextrin, Xanthan Gum, Potassium Cetyl Phosphate, Caprylyl Glycol, Potassium Sorbate, Sodium Hydroxide, Tocopherol, Helianthus Annuus (Sunflower) Seed Oil, Avena Sativa (Oat) Kernel Extract, Centaurea Cyanus Flower Extract, Parfum (Fragrance).",https://www.sephora.com/product/caudalie-vinoclean-gentle-cleansing-almond-milk-P469444,Cleanser,
Milky Jelly Gentle Gel Face Cleanser,Glossier,$24.00 ,Size: 6 oz/177 mL,"Water/Aqua/Eau, Rosa Damascena Flower Water, PEG-7 Glyceryl Cocoate, Propanediol, Poloxamer 184, Acrylamide/Sodium Acryloyldimethyltaurate Copolymer, Isohexadecane, Xylitylglucoside, Betaine, Allantoin, Glycerin, Panthenol, Symphytum Officinale Root Extract, Sodium Hyaluronate, Anhydroxylitol, Polysorbate 80, Xylitol, Ammonium Polyacryloyldimethyl Taurate, Isopropyl Myristate, Isopropyl Palmitate, Sorbitan Oleate, Benzoic Acid, Ethylhexylglycerin, Potassium Sorbate, Sodium Benzoate, Citric Acid, Sodium Hydroxide.",https://www.sephora.com/product/milky-jelly-gentle-gel-face-cleanser-P519350,Cleanser,
Daily Microfoliant Powder Exfoliant with Salicylic Acid and Rice Enzymes,Dermalogica,$69.00 ,Size: 2.6oz/73 grams,#NAME?,https://www.sephora.com/product/daily-microfoliant-P423688,Exfoliator,Acne
Your Favorite Ex™ Gentle Enzymatic and Physical Exfoliating Gel,YSE Beauty,$58.00 ,Size: 2.5 oz/75 mL,"-Pineapple and Papaya Enzymes: Dissolve dull, dead skin cells without irritation. -Cellulose Acetate: Provides gentle exfoliation, lifting away dead skin cells. -Squalane: Helps maintain essential hydration, locking in moisture to restore skin. Aqua/Water/Eau, Cellulose Acetate, Betaine, Glycerin, Pyrus Malus (Apple) Fruit Extract, Decyl Glucoside, Ammonium Polyacryloyldimethyl Taurate, Squalane, Tocopherol, Hibiscus Sabdariffa Flower Extract, Passiflora Edulis Fruit Extract, Guar Hydroxypropyltrimonium Chloride, Phenoxyethanol, Polyglyceryl-6 Caprylate, Polyglyceryl-3 Cocoate, Polyglyceryl-4 Caprate, Polyglyceryl-6 Ricinoleate, Chlorphenesin, Sorbitan Sesquioleate, Ethylhexylglycerin, T-Butyl Alcohol, Citric Acid, Sodium Phytate, Bromelain, Papain, 1,2-Hexanediol.",https://www.sephora.com/product/yse-beauty-your-favorite-ex-exfoliating-gel-P517106,Exfoliator,Exfoliating
