name,brand,price,size1,ingredients,url,category,subcategory
"Super Peptide & Ghostberry Moisturizer for Eczema, Barrier and Wrinkle Repair",ALPYN,$62.00 ,Size: 1.7 oz/50 mL,"-Snap 8 Peptide: Helps relax the look of expression lines. -Ghostberry and Tasmanian Pepper: Visibly soothes skin. -Five-Ceramide Complex: Binds moisture to skin and supports skin’s protective barrier. Water/Aqua/Eau, Glycerin, Caprylic/Capric/Myristic/Stearic Triglyceride, Caprylic/Capric Triglyceride, Squalane, Candelilla/Jojoba/Rice Bran Polyglyceryl-3 Esters, Coconut Alkanes, C12-16 Alcohols, Propanediol, Polyhydroxystearic Acid, Behenyl Alcohol, Glyceryl Stearate, Cetearyl Alcohol, Symphoricarpos Albus (Snowberry) Fruit Extract, Acetyl Hexapeptide-8, Acetyl Octapeptide-3, Ceramide NP, Ceramide EOP, Ceramide NS, Ceramide AS, Ceramide AP, Glyceryl Citrate/Lactate/Linoleate/Oleate, 1,2-Hexanediol, Cetearyl Olivate, Hydrogenated Lecithin, Nephelium Lappaceum Peel Extract, Palmitic Acid, Sodium Stearoyl Lactylate, Sorbitan Olivate, Caprylhydroxamic Acid, Coco-Caprylate/Caprate, Xanthan Gum, Simmondsia Chinensis (Jojoba) Seed Oil, Tasmannia Lanceolata Fruit/Leaf Extract, Bisabolol, Sodium Hyaluronate, Hydrolyzed Sodium Hyaluronate, Tripeptide-29, Hydrolyzed Pea Protein, 2,3-Butanediol, Leuconostoc/Radish Root Ferment Filtrate, Hydrolyzed Rice Protein, Cholesterol, Sodium Benzoate.",https://www.sephora.com/product/super-peptide-ghostberry-moisturizer-for-barrier-wrinkle-repair-P507952,Moisturizer,"Anti-Aging, Soothing, Nourishing"
Sculpting Neck & Jawline Mask,StriVectin,$18.00 ,Size: 1 mask/pack,"-NIA-114™: Supports the skin barrier and promotes skin longevity. -Alpha-3 Peptide™: Targets skin’s collagen and elastin, with hyaluronic acid to visibly plump and smooth. -Caffeine: Diminishes visible puffiness for a tighter, more toned appearance. Water/Aqua/Eau, Glycerin, Sodium Polyacrylate, Dipropylene Glycol, Agar, Pentapeptide-84 Amide Acetate, Myristyl Nicotinate, Caffeine, Polyacrylic Acid, Hydroxyacetophenone, Hydroxyethyl Urea, Xanthan Gum, Caprylyl Glycol, Caprylyl/Capryl Glucoside, Cellulose Gum, Tartaric Acid, Cetyl Ethylhexanoate, Dipotassium Glycyrrhizate, Disodium EDTA, Aluminum Glycinate.",https://www.sephora.com/product/strivectin-sculpting-neck-jawline-mask-P520958,Face Mask,
Barrier Build Skin Protectant Cream – Moisturizer with Ceramides,ILIA,$64.00 ,Size: 1.69 oz / 50 mL,"-1% Colloidal Oatmeal: Soothes and supports the skin barrier. -Ceramide Complex: Nourishes the skin barrier and soothes skin. -Algae Hydragel: Draws in moisture like a magnet for long-lasting hydration. Colloidal Oatmeal 1%, Aqua/Water/Eau, Caprylic/Capric Triglyceride, Squalane,Glycerin, Arachidyl Alcohol, Propanediol, Butyrospermum Parkii (Shea) Butter,Behenyl Alcohol, Avena Sativa (Oat) Kernel Extract, Lithothamnion Calcareumextract, Ophiopogon Japonicus Root Extract, Lactic Acid, Polyglycerin-6,Polyglyceryl-6 Laurate, Sodium Acrylate/Sodium Acryloyldimethyl Tauratecopolymer, Arachidyl Glucoside, C15-19 Alkane, Maltodextrin, Amylopectin,Hydrogenated Lecithin, Biosaccharide Gum-1, Pentylene Glycol, Trisodiumethylenediamine Disuccinate, Sodium Levulinate, Calcium Chloride, Glycerylcaprylate, Xanthan Gum, P-Anisic Acid, 1,2-Hexanediol, Caprylyl Glycol, Glucose,Sorbitan Oleate, Sorbitan Isostearate, Potassium Sorbate, Sodium Benzoate,Citric Acid.",https://www.sephora.com/product/ilia-barrier-build-skin-protectant-cream-P514777,Moisturizer,Soothing
Vital Hydra Solution™ Water Cream Glow Moisturizer with Hyaluronic Acid,Dr. Jart+,$39.00 ,Size: 1.69 oz / 50 mL,"-Hyaluronic Acid: Hydrates skin. -PENTAVITIN™: Supports skin’s barrier to hold in hydration. Water/Aqua/Eau, Propanediol, Phenyl Trimethicone, Betaine, Glycerin, Niacinamide, Glyceryl Glucoside, Saccharide Isomerate, Vinyl Dimethicone, Caprylyl Glycol, Sodium Hyaluronate, Dimethiconol, Ethylhexylglycerin, Adenosine, Beta-Glucan, Polymethylsilsesquioxane, Ammonium Acryloyldimethyltaurate/Vp Copolymer, 1,2-Hexanediol, Ammonium Acryloyldimethyltaurate/Beheneth-25 Methacrylate Crosspolymer, Hydroxyethyl Acrylate/Sodium Acryloyldimethyl Taurate Copolymer, Pentylene Glycol, Sorbitan Isostearate, Citric Acid, Fragrance (Parfum), Sodium Citrate.",https://www.sephora.com/product/vital-hydra-hydro-plump-water-cream-P506709,Moisturizer,Hydrating
Super Sculpt Serum For Face & Neck with Tri-Peptide Firming Complex,ALPYN,$62.00 ,Size: 1.7 oz/50 mL,"-Super Peptide Complex: Relaxes the look of fine lines and wrinkles. -Chokecherry: Visibly tightens. -Prickly Pear and Lactic Acid: Exfoliate and soften skin’s appearance. Water/Aqua/Eau, Propanediol, Hydrolyzed Opuntia Ficus-Indica Flower Extract, Aloe Barbadensis Leaf Juice, Glycerin, Acetyl Hexapeptide-8, Acetyl Octapeptide-3, Acetyl Tetrapeptide-2, Lactic Acid, Sodium Hyaluronate, Urea, Pyrus Malus (Apple) Fruit Extract, Acrylates/C10-30 Alkyl Acrylate Crosspolymer, Hydrogenated Ethylhexyl Olivate, Sclerotium Gum, Sodium Hydroxide, Populus Tremuloides Bark Extract, Benzyl Alcohol, Sodium Citrate, Dehydroacetic Acid, Benzoic Acid, Sodium Gluconate, Hydrogenated Olive Oil Unsaponifiables, Yeast Amino Acids, Cucumis Sativus (Cucumber) Seed Oil, Simmondsia Chinensis (Jojoba) Seed Oil, Caprylyl Glycol, Sodium Benzoate, Prunus Virginiana (Chokecherry) Extract, Beta Vulgaris (Beet) Root Extract, Leuconostoc/Radish Root Ferment Filtrate, Lactobacillus Ferment.",https://www.sephora.com/product/super-sculpt-serum-for-face-neck-P516194,Serum,Anti-Aging
TL Advanced™  Tightening Neck Cream PLUS with Alpha-3 Peptide ™,StriVectin,$59.00 ,Size: 1 oz / 30 ml,"-Alpha 3 Peptides: Visibly lift and smooth skin. -Spilanthol: Firms the look of skin by visibly tightening elasticity. -Bearberry Leaf Extract: Visibly brightens and evens dull skin tone. Aqua/Water/Eau, Butyrospermum Parkii (Shea) Butter, Glycerin, Bis-Stearyl Dimethicone, Myristyl Nicotinate, Trimethylolpropane Tricaprylate/Tricaprate, Cetearyl Alcohol, Isononyl Isononanoate, Behenyl Alcohol, Propanediol, Caprylic/Capric Triglyceride, Glyceryl Stearate, Oryza Sativa (Rice) Bran Extract, Helianthus Annuus (Sunflower) Extract, Adenosine, Arctostaphylos Uva Ursi Leaf Extract, Oryza Sativa (Rice) Extract, Rosmarinus Officinalis (Rosemary) Leaf Extract, Nannochloropsis Oculata Extract, Acmella Oleracea Extract, Oryza Sativa (Rice) Germ Extract, Acetyl Dipeptide-1 Cetyl Ester, Glycine Soja (Soybean) Oil, Pentapeptide-84 Amide Acetate, Butylene Glycol, Acrylates/C10-30 Alkyl Acrylate Crosspolymer, Polyglyceryl-3 Diisostearate, Sodium Acrylate/Sodium Acryloyldimethyl Taurate Copolymer, Ceteareth-20, Sorghum Bicolor Stalk Juice, Sclareolide, Pentylene Glycol, Trisodium Ethylenediamine Disuccinate, Polyisobutene, Sodium Polystyrene Sulfonate, Hydrated Silica, Ethylhexyl Isononanoate, 1,2-Hexanediol, Pullulan, Caprylhydroxamic Acid, Beta-Glucan, Caprylyl Glycol, Sorbitan Oleate, Hydroxyethylcellulose, Caprylyl/Capryl Glucoside, Sorbitan Laurate, Tocopherol, PEG-40 Stearate, Parfum (Fragrance), Aminomethyl Propanol, Potassium Sorbate, Sodium Benzoate, Citric Acid, Limonene.",https://www.sephora.com/product/tl-advanced-tm-tightening-neck-cream-plus-with-alpha-3-peptide-tm-P507877,Moisturizer,"Anti-Aging, Pore Care"
Rénergie H.P.N. 300-Peptide Anti-Aging Cream with SPF 25,Lancôme,$150.00 ,Size: 1.7 oz / 50 ml,"-300+ Types of Natural Peptides: Visibly improve firmness, elasticity, and wrinkles. -Hyaluronic Acid: Targets wrinkles and roughness and visibly smooths and re-plumps. Water, Glycerin, Silica, Dimethicone, Isononyl, Isononanoate, Propanediol, Bis-Peg-18 Methyl Ether Dimethyl Silane, Polyglyceryl-6 Distearate, Jojoba Esters, Tocopherol, Limnanthes Alba (Meadowfoam) Seed Oil, Cyclodextrin, Hydrolyzed Lupine Protein, Pisum Sativum (Pea) Extract, Adenosine, Capryloyl Salicylic Acid, Citric Acid, Disodium Edta, Hydrolyzed Linseed Extract, Hydroxyacetophenone, Scutellaria Baicalensis Root Extract, Sodium Hyaluronate, Sodium Hydroxide, Titanium Dioxide, Acacia Decurrens Flower Wax, Ammonium Acryloyldimethyltaurate/Steareth-25 Methacrylate Crosspolymer, Caprylyl Glycol, Cetyl Alcohol, Disodium Stearoyl Glutamate, Helianthus Annuus (Sunflower) Seed Wax, Polyglycerin-3, Polyglyceryl-3 Beeswax, Xanthan Gum, Dimethicone/Vinyl Dimethicone Crosspolymer, Dimethiconol, Benzyl Alcohol, Geraniol, Limonene, Red 33, Phenoxyethanol, Sodium Benzoate, Fragrance.",https://www.sephora.com/product/renergie-h-p-n-300-peptide-anti-aging-cream-with-spf-25-P507510,Moisturizer,"Sunscreen, Anti-Aging"
ATOBARRIER365 Cooling Hydro Soothing Gel-Cream Moisturizer with Ceramides for Skin Moisture Barrier Repair,AESTURA,$32.00 ,Size: 2.03 oz / 60 mL,"-BMF™ (Barrier Moisturizing Factors): Quickly hydrates and nourishes moisture in barrier. -Glycerin, Trehalose: Deliver hydration. -Triple Lipid Complex: Ceramides, fatty acids, and cholesterol mimic skin lipids to lock in moisture. Water / Aqua / Eau, Propanediol, Glycerin, Phenyl Trimethicone, Methyl Trimethicone, 1,2-Hexanediol, Trehalose, Dicaprylyl Carbonate, Ammonium Acryloyldimethyltaurate/Vp Copolymer, Hydrogenated Lecithin, Hydrogenated Polyisobutene, Hydroxyethyl Acrylate/Sodium Acryloyldimethyl Taurate Copolymer, Cetearyl Alcohol, Acrylates/C10-30 Alkyl Acrylate Crosspolymer, Glyceryl Caprylate, Glyceryl Stearate, Tromethamine, Disodium Edta, Ethylhexylglycerin, Stearic Acid, Palmitic Acid, Polyglyceryl-3 Methylglucose Distearate, Sorbitan Isostearate, Mannitol, Arginine, Serine, Sucrose, Pca, Citrulline, Glycogen, Histidine Hcl, Alanine, Tocopherol, Hydroxypropyl Bispalmitamide Mea, Threonine, Glutamic Acid, Myristic Acid, Arachidic Acid, Lysine Hcl, Acrylates/Ammonium Methacrylate Copolymer, Cholesterol, Silica.",https://www.sephora.com/product/atobarrier365-cooling-hydro-soothing-gel-cream-with-ceramides-for-skin-moisture-barrier-repair-P515484,Moisturizer,"Hydrating, Soothing, Nourishing"
Hydra Vizor Refillable Invisible Face Moisturizer SPF 30 with Niacinamide,Fenty Beauty by Rihanna,$45.00 ,Size + Concentration: 1.7 oz/ 50 mL,"-Hyaluronic Acid and Aloe: Hydrate, soothe, and condition. -Niacinamide: Fights shine and reduces the look of pores and dark spots. -Kalahari Melon: Delivers vitamin and antioxidant-packed hydration. -Baobab: A nutrient-rich superfruit that helps hydrate Avobenzone 3%, Homosalate 9%, Octisalate 4.5%: Sunscreens, Water, Glycerin, Carthamus Tinctorius (Safflower) Oleosomes, Pentylene Glycol, Butylene Glycol, C12-15 Alkyl Benzoate, Niacinamide, Zea Mays (Corn) Starch, Hyaluronic Acid, Sodium Hyaluronate, Citrullus Lanatus (Watermelon) Seed Extract, Adansonia Digitata Pulp Extract, Barosma Betulina Leaf Extract, Aloe Barbadensis Leaf Juice, Tocopheryl Acetate, Gluconolactone, Sorbitan Oleate, Acrylates/C10-30 Alkyl Acrylate Crosspolymer, Sodium Acrylate/Sodium Acryloyldimethyl Taurate Copolymer, Dimethicone, Isohexadecane, Ethylhexyl Methoxycrylene, Polysorbate 80, Xanthan Gum, Sodium Hydroxide, Citric Acid, Potassium Hydroxide, Tocopherol, Trisodium Ethylenediamine Disuccinate, Ethylhexylglycerin, Sodium Benzoate, Potassium Sorbate, Phenoxyethanol, Fragrance, Benzyl Salicylate, Citral, Hexyl Cinnamal, Limonene, Linalool, Red 33.",https://www.sephora.com/product/fenty-skin-hydra-vizor-moisturizer-broad-spectrum-spf-30-sunscreen-P467249,Moisturizer,Sunscreen
Bio-Active Ceramide Repairing and Plumping Moisturizer + Barrier Strengthening,The INKEY List,$21.50 ,Size: 1.7 oz,"-0.2% Bioactive Ceramides: Visibly smooth, firm, and support skin's moisture barrier. -5% Gransil Blur: Blurs the appearance of fine lines. -3.5% Shea Butter: Nourishes and reduces skin's water loss to help protect the moisture barrier. Water (Aqua/Eau), Glycerin, Butyrospermum Parkii (Shea) Butter, C12-15 Alkyl Benzoate, Propanediol, Polysilicone-11, C10-18 Triglycerides, Caprylic/Capric Triglyceride, Pentaerythrityl Tetraisostearate, Cetearyl Olivate, Sorbitan Olivate, Cetyl Alcohol, Phenoxyethanol, Ceramide NP, Polyacrylate-13, Hydrogenated Polyisobutene, Ethylhexylglycerin, Polyglyceryl-10 Laurate, Ethylhexyl Palmitate, Laureth-12, Sorbitan Isostearate, HDI/Trimethylol Hexyllactone Crosspolymer, Polymethylsilsesquioxane, Citric Acid, Sodium Hydroxide.",https://www.sephora.com/product/the-inkey-list-bio-active-ceramide-repairing-plumping-moisturizer-P509315,Moisturizer,"Hydrating, Soothing, Nourishing"
Even Better™ Brightening Moisturizer SPF 20 for Dark Spots,CLINIQUE,$65.00 ,Size: 1.7 oz / 50 mL,"Water/Aqua/Eau, Dimethicone, Butylene Glycol, Glycerin, Trisiloxane, Trehalose, Sucrose, Ammonium Acryloyldimethyltaurate/Vp Copolymer, Hydroxyethyl Urea, Camellia Sinensis (Green Tea) Leaf Extract, Silybum Marianum (Lady'S Thistle) Extract, Betula Alba (Birch) Bark Extract, Saccharomyces Lysate Extract, Aloe Barbadensis Leaf Water, Aloe Barbadensis Leaf Extract, Thermus Thermophillus Ferment, Caffeine, Sorbitol, Palmitoyl Hexapeptide-12, Sodium Hyaluronate, Caprylyl Glycol, Oleth-10, Sodium Polyaspartate, Aloe Barbadensis Leaf Polysaccharides, Lactobacillus Ferment Lysate, Saccharide Isomerate, Hydrogenated Lecithin, Tocopheryl Acetate, Acrylates/C10-30 Alkyl Acrylate Crosspolymer, Glyceryl Polymethacrylate, Tromethamine, Peg-8, Hexylene Glycol, Magnesium Ascorbyl Phosphate, Citric Acid, Bht, Disodium Edta, Sodium Citrate, Potassium Sorbate, Sodium Benzoate, Phenoxyethanol, Red 4 (Ci 14700), Yellow 5 (Ci 19140).",https://www.sephora.com/product/clinique-even-better-brightening-moisturizer-spf-20-P504674,Moisturizer,"Sunscreen, Brightening"
Pro-Collagen Anti Aging Marine Cream SPF 30,Elemis,$145.00 ,Size: 1.69 oz,"-Ginkgo Biloba: An antioxidant-rich algae that protects the skin from everyday stressors. -Chlorella: A green microalgae that maintains skin’s visible firmness. -Padina Pavonica: Algae found on the Mediterranean coast, supports hydration. Aqua/Water/Eau, Glycerin, Caprylic/Capric Triglyceride, Glyceryl Stearate SE, Isononyl Isononanoate, Dicaprylyl Carbonate, Dimethicone, Butyl Methoxydibenzoylmethane, Ethylhexyl Methoxycinnamate, Phenoxyethanol, Polyacrylate-13, Butylene Glycol, Cetyl Alcohol, Hydroxyacetophenone, Octocrylene, Stearic Acid, Tocopheryl Acetate, CocoCaprylate, Xanthan Gum, Chlorphenesin, Polyisobutene, Fragrance (Parfum), Disodium EDTA, Lecithin, Tocopherol, Butyrospermum Parkii (Shea) Butter, Citric Acid, Daucus Carota Sativa (Carrot) Root Extract, Triticum Vulgare (Wheat) Germ Oil, Chlorella Vulgaris Extract, Glyceryl Polyacrylate, Benzyl Benzoate, Glyceryl Acrylate/Acrylic Acid Copolymer, Padina Pavonica Thallus Extract, Sodium Dehydroacetate, Polysorbate 20, Sorbitan Isostearate, Ginkgo Biloba Leaf Extract, Porphyridium Cruentum Extract, Dipropylene Glycol, Citronellol, Geraniol, Hydroxycitronellal, Citrus Limon (Lemon) Peel Oil, Limonene, Potassium Sorbate, Sodium Benzoate, Citrus Aurantium Amara (Bitter Orange) Peel Oil.",https://www.sephora.com/product/elemis-pro-collagen-anti-aging-marine-cream-spf-30-P510337,Moisturizer,"Sunscreen, Anti-Aging"
Barrier Restore Cream Comforting Daily Moisturizer,rhode,$32.00 ,Size: 1.7oz/50ml,"- Peptides: Short chains of amino acids that reduce the look of fine lines. - Shea Butter: Hydrates and moisturizes with 5 essential fatty acids. - Hyaluronic Acid: High molecular weight HA draws in hydration and replenishes skin. water/aqua/eau, glycerin, caprylic/capric triglyceride, butyrospermum parkii (shea) butter, behenyl alcohol, xylitylglucoside, niacinamide, squalane, sodium acrylates copolymer, acetyl tetrapeptide-2, palmitoyl heptapeptide-27, palmitoyl oligopeptide-78, palmitoyl octapeptide-24, phenoxyethanol, anhydroxylitol, 1,2-hexanediol, hydroxyethyl acrylate/sodium acryloyldimethyl taurate copolymer, xylitol, lecithin, ethylhexylglycerin, glucose, bisabolol, sodium hyaluronate, teprenone, polysorbate 60, sorbitan isostearate, caprylyl glycol, euterpe oleracea fruit extract, potassium sorbate, citric acid, sorbic acid, lactic acid/glycolic acid copolymer, tocopherol, polyvinyl alcohol, sodium hydroxide.",https://www.sephora.com/product/barrier-restore-cream-P517477,Moisturizer,Soothing
Mini Triple Lipid-Peptide Cream Refillable Barrier Moisturizer with Ceramides,Skinfix,$20.00 ,Size: 0.5 oz / 15 mL,"-3% Triple Lipid Complex: Ceramides, sterols, and fatty acids mimic the skin’s barrier to lock in moisture. -3% Peptide Solution: Barrier-repair protein builders help skin retain more moisture on its own. -8% Humectant Blend: Hyaluronic acid, glycerin, and red algae deposit fast, lasting hydration. Water/Aqua/Eau, Caprylic/Capric Triglyceride, Glycerin, Butyrospermum Parkii (Shea) Butter, Olus Oil/Vegetable Oil/Huile végétale, Cetyl Lactate, Propanediol, C12-16 Alcohols, Caprylyl Caprylate/Caprate, Jojoba Oil/Macadamia Seed Oil Esters, Glyceryl Stearate Citrate, Palmitic Acid, Hydrogenated Lecithin, Oryza Sativa (Rice) Bran Extract, Dilinoleic Acid/Propanediol Copolymer, Squalene, Ophiopogon Japonicus Root Extract, Xanthan Gum, Phytosteryl Sunflowerseedate, Glycine Soja (Soybean) Extract, Pentylene Glycol, Ceramide NP, Ceramide AP, Ceramide EOP, Hydrolyzed Rice Protein, Chondrus Crispus Extract, Hydrogenated Vegetable Glycerides, Helianthus Annuus (Sunflower) Extract, Sodium Hyaluronate, Citric Acid, Phytosteryl Macadamiate, Tocopherol, Rosmarinus Officinalis (Rosemary) Leaf Extract, Aloe Barbadensis Leaf Juice, Trisodium Ethylenediamine Disuccinate, Phytosterols, Sodium Lauroyl Lactylate, Gluconolactone, Phenethyl Alcohol, Phytosphingosine, Cholesterol, Carbomer, Potassium Sorbate, Ethylhexylglycerin, Sodium Benzoate, Phenoxyethanol.",https://www.sephora.com/product/skinfix-mini-barrier-strengthening-and-plumping-triple-lipid-peptide-refillable-cream-with-b-l3-P479860,Moisturizer,"Anti-Aging, Soothing"
Super Multi-Corrective Anti-Aging Face and Neck Cream,Kiehl's Since 1851,$76.00 ,Size: 1.7 oz/ 50 mL,"-PhytoMimetic Vitamin A: Reduces the look of wrinkles. -Chaga Mushroom: Targets melanin overproduction, helping skin appear more even-toned. -Hyaluronic Acid: Visibly hydrates and smooths skin's texture. Aqua / Water / Eau, Glycerin, Dicaprylyl Ether, Butyrospermum Parkii Butter / Shea Butter, Hydroxypropyl Tetrahydropyrantriol, Isononyl Isononanoate, Propylene Glycol, Isopropyl Isostearate, Cetyl Alcohol, Dimethicone, Behenyl Alcohol, Candelilla Cera / Candelilla Wax / Cire De Candelilla, Glyceryl Stearate, Stearic Acid, Hydroxyethylpiperazine Ethane Sulfonic Acid, Palmitic Acid, Phenoxyethanol, Cetearyl Alcohol, Citric Acid, Carbomer, Capryloyl Salicylic Acid, Sodium Hydroxide, Caprylyl Glycol, Peg-100 Stearate, Vigna Aconitifolia Seed Extract, Tocopherol, Xanthan Gum, Cetearyl Glucoside, Sodium Cocoyl Glutamate, Sodium Hyaluronate, Disodium Edta, Pentylene Glycol, Jasminum Officinale Flower Extract / Jasmine Flower Extract, Myristic Acid, Rosmarinus Officinalis Leaf Oil / Rosemary Leaf Oil, Adenosine, Inonotus Obliquus (Mushroom) Extract, Limonene, Linalool, Pelargonium Graveolens Flower Oil, Lavandula Angustifolia Oil / Lavender Oil, Rosa Damascena Flower Oil. .",https://www.sephora.com/product/kiehls-super-multi-corrective-cream-P461948,Moisturizer,Anti-Aging
Priming Moisturizer Balance Oil-Control Gel-Cream,Glossier,$26.00 ,Size: 1.7 oz / 50 mL,"-Glycerin: Hydrates. -Customized Power Primers: Create a smooth base for makeup. -Willow Bark Extract: Smooths skin. Water/Aqua/Eau, Glycerin, Methyl Methacrylate Crosspolymer, Propanediol, Pyrus Malus (Apple) Fruit Extract, Pentylene Glycol, Polymethylsilsesquioxane, Pseudoalteromonas Ferment Extract, Niacinamide, Bambusa Arundinacea Stem Extract, Dimethicone, Salix Nigra (Willow) Bark Extract, Tamarindus Indica Seed Gum, Squalane, Hydroxyacetophenone, Isononyl Isononanoate, Hydroxyethyl Acrylate/Sodium Acryloyldimethyl Taurate Copolymer, Acrylates/C10-30 Alkyl Acrylate Crosspolymer, Glyceryl Citrate/Lactate/Linoleate/Oleate, Potassium Hydroxide, Carbomer, Glyceryl Caprylate, Glyceryl Polyacrylate, Tocopherol, Polyglyceryl-3 Caprate, Polyglyceryl-4 Cocoate, Trisodium Ethylenediamine Disuccinate, Polysorbate 60, Sorbitan Isostearate, Sodium Salicylate, 1,2-Hexanediol, Caprylyl Glycol.",https://www.sephora.com/product/glossier-priming-moisturizer-balance-oil-control-gel-cream-P504810,Moisturizer,Oil Control
Omega Repair Deep Hydration Moisturizer with Ceramides and Hyaluronic Acid + Squalane,Biossance,$60.00 ,Size: 1.69 oz / 50 mL,#NAME?,https://www.sephora.com/product/squalane-omega-repair-cream-P433887,Moisturizer,"Hydrating, Soothing, Nourishing"
C5 Super Boost Vitamin C Moisturizer for Brightening and Evening Tone,Paula's Choice,$49.00 ,Size: 1.7 oz / 50 mL,"-Vitamin C 5%: Visibly brightens dullness by countering free-radical damage. -Hexapeptide-5: Supports barrier health and trains skin to stay hydrated over time. -Polyglutamic Acid: Draws water into skin and holds it there for a supple, firm feel. Water/Aqua/Eau, Dicaprylyl Carbonate, 3-O-Ethyl Ascorbic Acid, Dimethicone, Butylene Glycol, Polyglyceryl-6 Distearate, Ascorbyl Glucoside, Squalane, Hydroxyethyl Acrylate/Sodium Acryloyldimethyl Taurate Copolymer, Acetyl sh-Hexapeptide-5 Amide Acetate, Citrullus Lanatus (Watermelon) Seed Oil, Hydrogenated Lecithin, Theobroma Cacao (Cocoa) Seed Butter, Hydrogenated Phosphatidylcholine, Pentaerythrityl Tetra-di-t-butyl Hydroxyhydrocinnamate, Sodium Hyaluronate, Oryza Sativa (Rice) Bran Extract, Propanediol, Jojoba Esters, Tocopherol, Acetyl Zingerone, Cetyl Palmitate, Caprylyl Glycol, Cetyl Alcohol, Polyglyceryl-3 Beeswax, Sodium Hydroxide, Sorbitan Olivate, Sorbitan Palmitate, Helianthus Annuus (Sunflower) Extract, Ethylhexylglycerin, Hexylene Glycol, Sodium Phytate, Polysorbate 60, Sorbitan Isostearate, Lecithin, Rosmarinus Officinalis (Rosemary) Leaf Extract, Glycine Soja (Soybean) Oil, Lysolecithin, Bacillus Ferment, Citric Acid, Polyglutamic Acid, Beta-Sitosterol, Phytic Acid, Squalene, Phenoxyethanol, Sodium Benzoate, Potassium Sorbate.",https://www.sephora.com/product/c5-super-boost-vitamin-c-moisturizer-P501282,Moisturizer,Brightening
"Vitamin B, C, and E Moisturizer",The INKEY List,$10.50 ,Size: 1.7 oz/ 50 mL,"-Vitamin B3 (Niacinamide): Helps control excess oil and the look of redness. -Vitamin C: Brightens the appearance of dull skin and increases radiance -Vitamin E: Soothes while helping to reduce the appearance of blemish scars. Aqua (Water/Eau), Glycerin, Glyceryl Stearate SE, Cetearyl Alcohol, Caprylic/Capric Triglyceride, Cocos Nucifera (Coconut) Oil, Stearic Acid, Phenoxyethanol, Benzyl Alcohol, Carbomer, Sodium Hydroxide, Niacinamide, Panthenol, Sodium Ascorbyl Phosphate, Sodium Hyaluronate, Tocopheryl Acetate, Ethylhexylglycerin, Dehydroacetic Acid, Lecithin, Trisodium Ethylenediamine Disuccinate, Ascorbyl Palmitate, Tocopherol, Helianthus Annuus (Sunflower) Seed Oil.",https://www.sephora.com/product/the-inkey-list-vitamin-b-c-e-moisturizer-P455365,Moisturizer,Brightening
Mochi Mochi Luminous Plumping & Hydrating Moisturizer,DAMDAM,$48.00 ,Size: 1.8 oz / 50 g,"-Shiso Leaf: A Japanese herb packed with antioxidants and omega-3s to plump cells. -Phytic Acid: A gently exfoliating AHA in Japanese rice that smooths and visibly evens skin tone. Water, Glycerin,Helianthus Annuus (Sunflower) Seed Oil, Butyrospermum Parkii (Shea) Butter, Butylene Glycol, Propanediol Dicaprylate/Caprate, Pentylene Glycol, Behenyl Alcohol, Coco-Caprylate/Caprate, Glyceryl Stearate, Polyglyceryl-2 Stearate, Cetearyl Glucoside, Cetearyl Alcohol, Diglycerin, Stearyl Alcohol, Sodium Stearoyl Lactylate, Sodium Citrate, Salix Alba (Willow) Bark Extract, Perilla Ocymoides Leaf/Stem Oil, Phytic Acid, Tocopherol.",https://www.sephora.com/product/dam-dam-mochi-mochi-luminous-plumping-moisturizer-P472021,Moisturizer,Hydrating
Vitamin C Brightening Gel Cream Moisturizer for Dark Spots,innisfree,$32.00 ,Size: 1.69 oz/50 mL,"-Vitamins C and E and Ferulic Acid: Brighten the look of dark spots. -Hyaluronic Acid and Squalane: Intensely hydrate and nourish. -Green Tea-Derived Enzyme: Promotes skin turnover for a more even complexion. Water/Aqua/Eau, Butylene Glycol, Propanediol, Glycerin, Niacinamide, Isopentyldiol, 1,2-Hexanediol, Hydrogenated Poly(C6-14 Olefin), Caprylic/Capric Triglyceride, Isononyl Isononanoate, Squalane, Ammonium Acryloyldimethyltaurate/VP Copolymer, Acrylates/C10-30 Alkyl Acrylate Crosspolymer, Arginine, Trehalose, Hydroxyethyl Acrylate/Sodium Acryloyldimethyl Taurate Copolymer, Sodium Acrylic Acid/MA Copolymer, Dextrin, Xanthan Gum, 3-O-Ethyl Ascorbic Acid, Cetearyl Olivate, Citrus Reticulata (Tangerine) Peel Extract, Castor Oil/IPDI Copolymer, Coptis Japonica Root Extract, Ethylhexylglycerin, Daucus Carota Sativa (Carrot) Root Extract, Sorbitan Olivate, Canola Oil/Huile De Colza, Cyclodextrin, Sodium Phytate, Glyceryl Acrylate/Acrylic Acid Copolymer, Sorbitan Isostearate, Protease*, Caprylyl Glycol, PVM/MA Copolymer, Daucus Carota Sativa (Carrot) Seed Oil, Carbomer, Ascorbyl Tetraisopalmitate, Tocopheryl Acetate, Beta-Carotene, Helianthus Annuus (Sunflower) Seed Oil, Amodimethicone, Glucose, Sodium Hyaluronate, Panthenol, Chondrus Crispus Extract, Hydroxypropyltrimonium Hyaluronate, Sodium Ascorbyl Phosphate, Tocopherol, Magnesium Ascorbyl Phosphate, Glutathione, Ferulic Acid, Linum Usitatissimum (Linseed) Seed Oil, Hydrolyzed Hyaluronic Acid, Sodium Acetylated Hyaluronate, Cyanocobalamin, Gluconolactone, Hyaluronic Acid, Sodium Hyaluronate Crosspolymer, Hydrolyzed Sodium Hyaluronate, Potassium Hyaluronate, Linolenic Acid, Linoleic Acid, Ascorbic Acid, Biotin, Folic Acid, Riboflavin, Pyridoxine, Thiamine HC.",https://www.sephora.com/product/green-tea-enzyme-vitamin-c-brightening-cream-P516522,Moisturizer,Brightening
