name,brand,price,size1,ingredients,url,category,subcategory
Dior Addict Lip Glow Balm,DIOR,$42.00 ,Color: 001 Pink - a light pink cool undertone,"- Cherry Extract: Nourishes and hydrates. - Shea Butter: Nourishes. Polyglyceryl-2 Triisostearate, Helianthus Annuus (Sunflower) Seed Oil, Hydrogenated Castor Oil Dimer Dilinoleate, Phytosteryl/Octyldodecyl Lauroyl Glutamate, Jojoba Esters, Polyglyceryl-2 Isostearate/Dimer Dilinoleate Copolymer, Candelilla Cera (Euphorbia Cerifera (Candelilla) Wax), Behenyl Behenate, Helianthus Annuus (Sunflower) Seed Wax, Butyrospermum Parkii (Shea) Butter, Oryza Sativa (Rice) Bran Wax, Caprylic/Capric Triglyceride, Parfum (Fragrance), Butyrospermum Parkii (Shea) Butter Unsaponifiables, Diisostearyl Malate, Prunus Avium (Sweet Cherry) Seed Oil, Tocopherol, Ethyl Vanillin, Trimethylolpropane Triisostearate, Ascorbyl Palmitate, Undaria Pinnatifida Extract, Aluminum Hydroxide, Propyl Gallate, [+/- Ci 77891 (Titanium Dioxide), Ci 45380 (Red 21), Ci 15850 (Red 6, Red 7 Lake), Ci 73360 (Red 30 Lake)].",https://www.sephora.com/product/dior-addict-lip-glow-balm-P514572,Lip Care,
Dior Capture Rich Creme,DIOR,$160.00 ,Size: 1.7 oz/50 mL,"Aqua (Water), Squalane, Glycerin, Butylene Glycol, Propanediol, Prunus Amygdalus Dulcis (Sweet Almond) Oil, Alcohol, Theobroma Grandiflorum Seed Butter, Jojoba Esters, Arachidyl Alcohol, Cetyl Alcohol, Stearyl Alcohol, Triheptanoin, Polyglycerin-3, Lilium Candidum Bulb Extract, Jasminum Officinale (Jasmine) Flower Extract, C10-18 Triglycerides, Behenyl Alcohol, Coco-Caprylate/Caprate, Dimethicone, Parfum (Fragrance), Hydroxyethyl Acrylate/Sodium Acryloyl-Dimethyl Taurate Copolymer, Cellulose, Arachidyl Glucoside, Acrylates/C10-30 Alkyl Acrylate Crosspolymer, Hydroxyacetophenone, Xylitol, Chlorphenesin, Dilinoleic Acid/Butanediol Copolymer, Sodium Stearoyl Glutamate, Tocopheryl Acetate, Betaine, Ceramide Np, Sodium Surfactin, Xanthan Gum, Polyglycerin-6, Sodium Hyaluronate, Sodium Hydroxide, Adenosine, Pentylene Glycol, Polysorbate 60, Sorbitan Isostearate, Acetyl Dipeptide-1 Cetyl Ester, Tocopherol, Sodium Hyaluronate Crosspolymer, Synthetic Fluorphlogopite, Tropaeolum Majus Flower/Leaf/Stem Extract, Castor Oil/Ipdi Copolymer, Sodium Tocopheryl Phosphate, Palmaria Palmata Extract, Sodium Benzoate, Ci 77891 (Titanium Dioxide), Ci 77492 (Iron Oxides), Jasmine Oil/Extract, Ci 77491 (Iron Oxides), Silica, Tin Oxide.",https://www.sephora.com/product/dcapt-rich-creme-jar-50ml-int26-add-reform-to-name-P520282,Other,Nourishing
"Hyaluronic Serum — High‑Potency Hyaluronic Acid Serum for Deep Moisture, Plumping & Anti‑Aging",Dr. Barbara Sturm,$325.00 ,Size: 1 oz/ 30 mL,"-Custom-blended Hyaluronic Acid: A Dr. Sturm proprietary formulation of long and short chain hyaluronic molecules for intense, long-term hydration with a plumping effect; this serum is tested and proven to have the optimal concentration and viscosity to penetrate the skin. -Purslane: A strong antioxidant with high levels of vitamins A, C, E, and omega-3 fatty acids, it supports skin health and reduces the visible signs of irritation. Water, Butylene Glycol, Lactobacillus/Portulaca Oleracea Ferment Extract, Phenoxyethanol, Sodium Hyaluronate, Ethylhexylglycerin, Potassium Sorbate, Leuconostoc/Radish Root Ferment Filtrate.",https://www.sephora.com/product/dr-barbara-sturm-hyaluronic-serum-P447212,Serum,"Anti-Aging, Hydrating"
"Face Cream — Gentle Daily Cream for Sensitive Skin, Hydration & Anti-Aging Benefits",Dr. Barbara Sturm,$240.00 ,Size: 1.69 oz/ 50 mL,"-Purslane: A strong antioxidant that stimulates the body and supports skin health and rejuvenation. -Skullcap: Supports the body’s natural skin renewal function. -Shea Butter: Preserves moisture and tightens skin’s appearance. Water, Octyldodecanol, C12-15 Alkyl Benzoate, Glycerin, Butyrospermum Parkii (Shea) Butter, Decyl Oleate, Zea Mays (Corn) Germ Oil, Cetearyl Alcohol, Glyceryl Stearate, Lactobacillus/Portulaca Oleracea Ferment Extract, Sorbitol, Propanediol, Potassium Cetyl Phosphate, Cocoglycerides, Dimethicone, Tocopheryl Acetate, Phenoxyethanol, Hydrogenated Palm Glycerides, Panthenol, Squalane, Carbomer, Xanthan Gum, Ethylhexylglycerin, Potassium Sorbate, Leuconostoc/Radish Root Ferment Filtrate, Alcohol, Caprylic/Capric Triglyceride, Baicalin, Pantolactone, Ascorbyl Palmitate, Citric Acid, Ascorbic Acid.",https://www.sephora.com/product/dr-barbara-sturm-face-cream-P447781,Moisturizer,"Anti-Aging, Hydrating, Soothing"
"Super Anti-Aging Serum — Anti-Aging, Firming & Hydrating Serum Against Fine Lines, Wrinkles & Loss of Elasticity",Dr. Barbara Sturm,$380.00 ,Size: 1 oz/ 30 mL,#NAME?,https://www.sephora.com/product/dr-barbara-sturm-super-anti-aging-serum-P447787,Serum,"Anti-Aging, Hydrating"
Alpha Beta® Ultra Gentle Daily Peel Pads for Sensitive Skin,Dr. Dennis Gross Skincare,$20.00 ,Size: 5 Treatments,"-Lactic Acid (AHA) and Malic Acid (AHA): Supports the speed up cell turnover and cell renewal and balances skin. -Hyaluronic Acid: Hydrates and visibly plumps skin. -Colloidal Oatmeal: Anti-irritant and soothes skin. Step 1: Water/Aqua/Eau, Hamamelis Virginiana (Witch Hazel) Water, Polysorbate 20, Lactic Acid, Mandelic Acid, Salix Alba (Willow) Bark Extract, Camellia Sinensis Leaf Extract, Achillea Millefolium Extract, Anthemis Nobilis Flower Extract, Chamomilla Recutita (Matricaria) Flower Extract, Saccharum Officinarum (Sugar Cane) Extract, Citrus Aurantium Dulcis (Orange) Fruit Extract, Citrus Limon (Lemon) Fruit Extract, Glycerin, Soy Isoflavones, Copper PCA, Zinc PCA, Potassium Hydroxide, Disodium EDTA, Citric Acid, Caprylic/Capric Triglyceride, Cucumis Sativus (Cucumber) Fruit Extract, Citrus Limon (Lemon) Peel Extract, Rose Extract, Triethyl Citrate, Pyrus Malus (Apple) Fruit Extract, Coriandrum Sativum (Coriander) Fruit/Leaf Extract, Fucus Vesiculosus Extract, Jasminum Officinale (Jasmine) Flower/Leaf Extract, Prunus Persica (Peach) Fruit Extract, Rosmarinus Officinalis (Rosemary) Leaf Extract, Rubus Idaeus (Raspberry) Fruit Extract, Vaccinium Macrocarpon (Cranberry) Fruit Extract, Vanilla Planifolia Fruit Extract, Citrus Aurantium Bergamia (Bergamot) Fruit Extract, Lavandula Angustifolia (Lavender) Flower/Leaf/Stem Extract, Benzoic Acid, Phenoxyethanol, Sodium Benzoate, Potassium Sorbate. Step 2: Water/Aqua/Eau, Caprylic/Capric Triglyceride, Polysorbate 20, Sodium Bicarbonate, Sodium Hyaluronate, Colloidal Oatmeal, Camellia Sinensis Leaf Extract, Centella Asiatica Extract, Phospholipids, Adenosine, Resveratrol, Ubiquinone, Soy Isoflavones, Achillea Millefolium Extract, Leuconostoc/Radish Root Ferment Filtrate, Glycerin, Sodium PCA, Copper PCA, Zinc PCA, Butylene Glycol, Octoxynol-9, Tetrasodium EDTA, Citric Acid, Phenoxyethanol, Sodium Benzoate, Potassium Sorbate.",https://www.sephora.com/product/alpha-beta-ultra-gentle-daily-peel-sensitive-skin-P398761,Exfoliator,"Soothing, Exfoliating"
Alpha Beta® Universal Daily Peel Pads,Dr. Dennis Gross Skincare,$92.00 ,Size: 30 Treatments + 5 Bonus,"-Glycolic Acid (AHA): Visibly reduces lines and wrinkles. -Lactic Acid (AHA) and Malic Acid (AHA): Supports cell turnover and cell renewal and visibly evens skin tone. -Resveratrol and Green Tea Extract: Extends skin cell lifespan and protects against free radicals. Step 1: Water/Aqua/Eau, Alcohol Denat. (SD Alcohol 40-B), Glycolic Acid, Potassium Hydroxide, Hamamelis Virginiana (Witch Hazel) Water, Salicylic Acid*, Polysorbate 20, Citric Acid, Lactic Acid, Malic Acid, Camellia Sinensis Leaf Extract, Achillea Millefolium Extract, Chamomilla Recutita (Matricaria) Flower Extract, Soy Isoflavones, Glycerin, Copper PCA, Zinc PCA, Lecithin, Alcohol, Polysorbate 80, Disodium EDTA, Fragrance (Parfum), Phenoxyethanol, Benzoic Acid, Sodium Benzoate, Potassium Sorbate (* - exfoliant). Step 2: Water/Aqua/Eau, Sodium Bicarbonate, Ascorbic Acid, Retinol, Tocopheryl Acetate, Resveratrol, Ubiquinone, Adenosine, Achillea Millefolium Extract, Camellia Sinensis Leaf Extract, Soy Isoflavones, Phospholipids, Leuconostoc/Radish Root Ferment Filtrate, Copper PCA, Sodium PCA, Zinc PCA, Glycerin, Polysorbate 20, Octoxynol-9, Tetrasodium EDTA, Phenoxyethanol, Sodium Benzoate, Potassium Sorbate. .",https://www.sephora.com/product/alpha-beta-universal-daily-peel-P377533,Exfoliator,Exfoliating
Major Fade Hyper Serum Dark Spot + Hyperpigmentation Treatment with Niacinamide and Glycerin,Dr. Idriss,$68.00 ,Size: 0.96 oz,"-Alpha Arbutin: Improves the appearance of uneven skin tone. -Kojic Acid: Diminishes the look of dark spots. -Niacinamide: Supports skin’s moisture barrier and visibly reduces discoloration. Water/Aqua/Eau, Niacinamide, Glycerin, Caprylic/Capric Triglyceride, Pentylene Glycol, Alpha-Arbutin, Butyrospermum Parkii (Shea) Butter, Squalane, Cetearyl Olivate, Dimethicone, Cetyl Alcohol, Sorbitan Olivate, Kojic Acid, Diglucosyl Gallic Acid, Glycyrrhiza Glabra (Licorice) Root Extract, Persea Gratissima (Avocado) Oil, Sclerotium Gum, Xanthan Gum, Citric Acid, Sodium Phytate, Caprylyl Glycol, Hexylene Glycol, Ethylhexylglycerin, Phenoxyethanol, Mica, Titanium Dioxide (Ci 77891).",https://www.sephora.com/product/major-fade-hyper-serum-dark-spot-treatment-P510575,Serum,"Brightening, Acne"
Left Un-Red Reducer Face Serum for Redness and Blemish Prone Skin,Dr. Idriss,$68.00 ,Size: 0.96 fl oz/28 ml,"-10% Azelaic Acid Complex: Reduces the look of breakouts and redness. -18-ß-Glycyrrhetinic Acid: Decreases redness and soothes skin irritation. -Capryloyl Glycine: Regulates oil production. Water/Aqua/Eau, Glycerin, Propanediol, Potassium Azeloyl Diglycinate, Azelaic Acid, Pentylene Glycol, Caprylic/Capric Triglyceride, Butyrospermum Parkii (Shea) Butter, Dipropylene Glycol, Cetearyl Olivate, Cetyl Alcohol, Sorbitan Olivate, Sodium Acrylate/Sodium Acryloyldimethyl Taurate Copolymer, Dimethicone, Sodium Hydroxide, Glycyrrhetinic Acid, Hydroxyphenyl Propamidobenzoic Acid, Salix Alba (Willow) Bark Extract, Apricot Kernel Oil Polyglyceryl-6 Esters, Proline, Magnolol, Honokiol, Sodium Phytate, Ascorbyl Palmitate, Bisabolol, Capryloyl Glycine, Ethylhexylglycerin, Butylene Glycol, Sorbitan Oleate, Polyglyceryl-6 Caprylate, Xanthan Gum, Polysorbate 80, Polyglycery-10 Oleate, Isohexadecane, Sorbitan Palmitate, Sodium Bicarbonate, Phenoxyethanol, Yellow 5 (CI 19140), Blue 1 (CI 42090).",https://www.sephora.com/product/dr-idriss-left-un-red-reducer-face-serum-for-redness-and-blemish-prone-skin-P519905,Serum,"Acne, Soothing"
B-Hydra™ Intensive Hydration Serum with Hyaluronic Acid,Drunk Elephant,$54.00 ,Size: 1.69 oz/ 50 mL,"-Pineapple Ceramide: Boosts luminosity and improves the appearance of skin’s texture and tone. -Provitamin B5: As a humectant, it attracts hydration to the skin and holds it there, visibly improving skin’s barrier function. -Sodium Hyaluronate: With a smaller molecular weight than hyaluronic acid, it is able to penetrate skin and deliver intense hydration to reduce the appearance of fine lines and wrinkles and promote visible firmness. Water, Coconut Alkanes, Ammonium Acryloyldimethyltaurate/VP Copolymer, Glycerin, Pentylene Glycol, Sclerocarya Birrea Seed Oil, Wheat Amino Acids, Ananas Sativus (Pineapple) Fruit Extract, Berberis Vulgaris Root Extract, Citrullus Lanatus (Watermelon) Fruit Extract, Lens Esculenta (Lentil) Fruit Extract, Pyrus Malus (Apple) Fruit Extract, Coco-Caprylate/Caprate, Panthenol, Sodium PCA, Sodium Hyaluronate Crosspolymer, Dipotassium Glycyrrhizate, Niacinamide, Cyclodextrin, Sodium Hyaluronate, Sodium Lactate, Phenoxyethanol, Hydroxyproline, Trisodium Ethylenediamine Disuccinate, Citric Acid, Caprylyl Glycol, Chlorphenesin, Ethylhexylglycerin.",https://www.sephora.com/product/b-hydra-intensive-hydration-gel-P406712,Serum,"Hydrating, Nourishing"
T.L.C. Sukari Babyfacial™ AHA + BHA Mask,Drunk Elephant,$80.00 ,Size: 1.69 oz/ 50 mL,"-AHA Blend Glycolic + (T) Tartaric, (L) Lactic, (C) Citric Acids 25%: Exfoliates dead surface skin cells and revs up surface turnover to smooth and brighten the appearance of skin. -Salicylic Acid (BHA) 2%: Penetrates to exfoliate and unclog inside pores as well as on the surface of the skin, providing greater visible skin clarity while soothing redness. -Chickpea Flour: Balances and brightens skin’s appearance while combating visible dullness. Water, Glycolic Acid, Hydroxyethyl Acrylate/Sodium Acryloyldimethyl Taurate Copolymer, Glycerin, Sodium Hydroxide, Salicylic Acid, Aloe Barbadensis Leaf Extract, Camellia Oleifera Leaf Extract, Lactobacillus/Pumpkin Ferment Extract, Lactobacillus/Punica Granatum Fruit Ferment Extract, Opuntia Ficus-Indica Extract, Pyrus Malus (Apple) Fruit Extract, Silybum Marianum Seed Extract, Saccharomyces Cerevisiae Extract, Vitis Vinifera (Grape) Juice Extract, Camellia Sinensis Leaf Powder, Cicer Arietinum Seed Powder, Sclerocarya Birrea Seed Oil, Passiflora Edulis Seed Oil, Leuconostoc/Radish Root Ferment Filtrate, Sodium Hyaluronate Crosspolymer, Sodium PCA, Allantoin, Dipotassium Glycyrrhizate, Dextrin, Polydextrose, Sorbitan Isostearate, Amylopectin, Niacinamide, Phytosphingosine, Lactic Acid, Propanediol, Citric Acid, Titanium Dioxide, Trisodium Ethylenediamine Disuccinate, Polysorbate 60, Caprylyl Glycol, Chlorphenesin, Phenoxyethanol.",https://www.sephora.com/product/t-l-c-sukari-babyfacial-P415777,Face Mask,Exfoliating
Protini™ Polypeptide Firming Refillable Moisturizer,Drunk Elephant,$72.00 ,Size: 1.69 oz/ 50 mL,"-Signal Peptide Complex (Growth Factors): Nine signal peptides (made up of aminoacids, which form proteins in the skin) bind moisture to skin—visibly plumping, firming,and restoring bounce. -Pygmy Waterlily Stem Cell Extract: An excellent source of antioxidants and nutrients to replenish the skin; extremely moisturizing, soothing, and calming; and effective in supporting healthy-, youthful-looking skin. -Soybean Folic Acid Ferment Extract: This B vitamin plays a central role in maintaining youthful-, elastic-looking skin. Skin is thirsty for folic acid, especially after exposure to sun. Water/Aqua/Eau, Dicaprylyl Carbonate, Glycerin, Cetearyl Alcohol, Cetearyl Olivate, Sorbitan Olivate, Sclerocarya Birrea Seed Oil, Bacillus/ Folic Acid Ferment Filtrate Extract, Nymphaea Alba Root Extract, sh-Oligopeptide-1, sh-Oligopeptide-2, sh-Polypeptide-1, sh-Polypeptide-9, sh-Polypeptide-11, Copper Palmitoyl Heptapeptide-14, Heptapeptide-15 Palmitate, Palmitoyl Tetrapeptide-7, Palmitoyl Tripeptide-1, Alanine, Arginine, Glycine, Histidine, Isoleucine, Phenylalanine, Proline, Serine, Threonine, Valine, Acetyl Glutamine, Coconut Alkanes, Coco-Caprylate/Caprate, Sodium Hyaluronate, Aspartic Acid, Linoleic Acid, Linolenic Acid, Lecithin, Butylene Glycol, Polyvinyl Alcohol, Sodium Lactate, Sodium PCA, PCA, Sorbitan Isostearate, Carbomer, Polysorbate 20, Polysorbate 60, Lactic Acid/Glycolic Acid Copolymer, Hydroxyethyl Acrylate/Sodium Acryloyldimethyl Taurate Copolymer, Xanthan Gum, Isomalt, 1,2-Hexanediol, Caprylyl Glycol, Chlorphenesin, Phenoxyethanol, Tocopherol, Sodium Benzoate, Phenylpropanol, Glyceryl Caprylate, Symphytum Officinale Callus Culture Extract.",https://www.sephora.com/product/protini-tm-polypeptide-cream-P427421,Moisturizer,Anti-Aging
Le Chouchou Exfoliating + Softening Peptide Lip Balm,EADEM,$24.00 ,Color: Boba Bounce - rich soft brown,"-Hibiscus Enzymes and Lactic Acid: Immediately buff away dry, flaky skin, so lips can absorb the balm's rich moisture. -Brazilian Açaí and African Mongongo Butters: Intensely nourish and lock in moisture, delivering protective antioxidants. -Collagen-Boosting Peptide: Restores a supple feel and visibly reduces fine lines for naturally plump-looking lips. Hydrogenated Polyisobutene, Diisostearyl Malate, Tridecyl Trimellitate, Phytosteryl/Isostearyl/Cetyl/Stearyl/Behenyl Dimer Dilinoleate, Bis-Diglyceryl Polyacyladipate-2, Methyl Hydrogenated Rosinate, Polyphenylsilsesquioxane, Pentaerythrityl Tetraisostearate, Ethylene/Propylene/Styrene Copolymer, Synthetic Wax, Silica Silylate, VP/Hexadecene Copolymer, Hibiscus Sabdariffa Flower Extract, Butyrospermum Parkii (Shea) Butter, Euterpe Oleracea Fruit Oil, Schinziophyton Rautanenii Kernel Oil, Tocopherol, Microcrystalline Wax, Moringa Oil/Hydrogenated Moringa Oil Esters, Isostearyl Alcohol, Water/Aqua/Eau, Ethylhexyl Palmitate, Octyldodecanol, Flavor (Aroma), Caprylic/Capric Triglyceride, Tribehenin, Sorbitan Isostearate, Propylene Carbonate, Stearalkonium Hectorite, Lactic Acid, Palmitoyl Hexapeptide-12, Palmitoyl Tripeptide-1, Butylene/Ethylene/Styrene Copolymer, Pentaerythrityl Tetra-di-t-butyl Hydroxyhydrocinnamate, Linalool, Iron Oxides (CI 77491/77492/77499), Red 7 Lake (CI 15850), Blue 1 Lake (CI 42090).",https://www.sephora.com/product/eadem-le-chouchou-exfoliating-softening-peptide-lip-balm-P511921,Lip Care,"Anti-Aging, Exfoliating"
"The Mark Advanced Targeted Dark Spot Concentrate with 5% Tranexamic Acid, 1% Alpha Arbutin & 1% Kojic Acid for Hyperpigmentation, Acne Marks & Age Spots",EADEM,$38.00 ,Size: 0.5 oz/15ml,"-5% Tranexamic Acid: Tackles redness and melanin transfer at the root. -1% Kojic Acid and 1% Alpha Arbutin: Are dual-action visible brighteners. -2% Acetyl Glycyl Beta‑Alanine: Disrupts pigment formation and transport at the cellular level. Water/Aqua/Eau, Caprylic/Capric Triglyceride, C15-19 Alkane, Butylene Glycol, Tranexamic Acid, Bis-Stearyl Dimethicone, Propanediol, Helianthus Annuus (Sunflower) Seed Wax, Polyglyceryl-20 Octadecabehenate/Hydroxystearate, Polyglyceryl-5 Polyricinoleate, Kojic Dipalmitate, Polyhydroxystearic Acid, Behenyl Behenate, Magnesium Sulfate, Alpha-Arbutin, Acetyl Glycyl Beta-Alanine, 1,2-Hexanediol, Tocopherol, Embelia Concinna Leaf Extract, Camellia Sinensis Leaf Extract, Oryza Sativa (Rice) Bran Oil, Panax Ginseng Root Extract, Euphorbia Cerifera (Candelilla) Wax, Lentinus Edodes Extract, Glycerin, Zinc Stearate, Polyglyceryl-2 Oleate, Octyldodecanol, Polyglyceryl-2 Stearate, Citric Acid, Stearic Acid, Sodium Benzoate, Iron Oxides (CI 77492).",https://www.sephora.com/product/the-mark-advance-dark-spot-concentrate-P517954,Serum,"Brightening, Acne"
O2 Caffeine Eight Active Brightening & Depuffing Eye Cream,Element Eight,$175.00 ,Size: 0.5 oz / 15 mL,"-Patented Liquid Oxygen: Supports skin cell health and improves the efficacy of any active ingredient. -Caffeine: A vasoconstrictor that reduces the look of dark circles and puffiness. -Peptides: Support collagen production and reduce the look of wrinkles. Aqua, Glyceryl Stearate Se, Stearic Acid, Coco-Caprylate/Caprate, Caffeine, Cetyl Alcohol, Butyrospermum Parkii (Shea Butter), Biosaccharide Gum-4, Glycerin, Oxygen, Aesculus Hippocastanum (Horse Chestnut) Extract, Acetyl Tetrapeptide-5, Acetyl Hexapeptide-8, Pentapeptide-18, Sodium Hyaluronate, Arnica Montana Flower Extract, Panthenol, Camellia Oleifera (Camellia) Seed Oil, Aloe Barbadensis Leaf Juice Powder, Caprylic/Capric Triglyceride, Phenoxyethanol, Tetrasodium Iminodisuccinate, Tocopheryl Acetate, Sodium Hydroxide.",https://www.sephora.com/product/o2-caffeine-eight-active-brightening-and-depuffing-eye-cream-P515719,Moisturizer,Brightening
Mini O2 Niacinamide Eight Active Serum for Dark Spots & Wrinkles,Element Eight,$185.00 ,Size: 0.5 oz / 15 mL,"-Patented Liquid Oxygen: Supports skin cells and improves efficacy of ingredients. -Niacinamide: Improves appearance of dark spots, wrinkles, and pores and visibly brightens skin. -Peptides: Supports natural collagen. Aqua, Niacinamide, Glycerin, Pentylene Glycol, Oxygen, Acetyl Hexapeptide-8, Pentapeptide-18, Palmitoyl Tripeptide-5, Palmitoyl Dipeptide-5, Hydrolyzed Hyaluronic Acid, Sodium Hyaluronate, Resveratrol, Carnosine, Allantoin, Sodium Carboxymethyl Beta-Glucan, Hydrolyzed Soy Protein, Rice Amino Acids, Aloe Barbadensis Leaf Juice Powder, Hydrolyzed Adansonia Digitata Seed Extract, Silybum Marianum Fruit Extract, Sodium Hydroxide, Sodium Benzoate, Carbomer, Panthenol, Hydroxyethylcellulose, Alcohol, Tetrasodium Iminodisuccinate, Phenoxyethanol, Tetradecyl Aminobutyroylvalylaminobutyric Urea Trifluoroacetate, Lecithin, Proline, Diaminobutyroyl Hydroxythreonine, Magnesium Chloride, Tocopherol.",https://www.sephora.com/product/o2-niacinamide-eight-active-serum-for-dark-spots-and-wrinkles-P515730,Serum,"Anti-Aging, Brightening"
Dynamic Gentle Resurfacing Pads with Lactic Acid,Elemis,$67.00 ,Size: 60 pads,"-Patented Tri-Enzyme Technology: Effectively breaks up the accumulation of dead skin cells. -Lactic Acid: Gently exfoliating AHA improves the look of skin tone and texture. -Probiotic Ferment Complex: Supports the skin’s renewal process. Aqua/Water/Eau, Butylene Glycol, Lactococcus Ferment Lysate, Polysorbate 20, Methyl Gluceth-20, Lactic Acid, Phenoxyethanol, Betaine, Sodium Hydroxide, Propylene Glycol, Disodium EDTA, Benzoic Acid, Fragrance (Parfum), Dehydroacetic Acid, Ethylhexylglycerin, Papain, Saponins, Sodium Benzoate, Sodium Chloride, Glycerin, Behenyl Alcohol, Butyrospermum Parkii (Shea) Butter, Hydrogenated Castor Oil, Stearyl Alcohol, Poria Cocos Extract, Protease, Saponaria Officinalis Leaf Extract, Subtilisin, Tocopheryl Acetate.",https://www.sephora.com/product/elemis-dynamic-gentle-resurfacing-pads-with-lactic-acid-P510338,Other,Exfoliating
Pro-Collagen Makeup Melting Cleansing Balm,Elemis,$42.00 ,Size: Original / 50 g,"-Padina Pavonica: Algae found on the Mediterranean coast, supports hydration. -Starflower Oil: Rich GLA source, promotes skin health by supporting its metabolism. -Elderberry Oil: High in levels of fatty acids and micronutrients—a key to healthy skin. Prunus Amygdalus Dulcis (Sweet Almond) Oil, Caprylic/Capric Triglyceride, PEG-6 Caprylic/Capric Glycerides, PEG-8 Beeswax, Cetearyl Alcohol, Sorbitan Stearate, Sambucus Nigra Oil, PEG-60 Almond Glycerides, Silica, Avena Sativa (Oat) Kernel Oil, Triticum Vulgare (Wheat) Germ Oil, Butyrospermum Parkii (Shea Butter), Citrus Aurantium Dulcis (Orange) Peel Wax, Glycerin, Lecithin, Borago Officinalis Seed Oil, Lavandula Angustifolia (Lavender) Oil, Phenoxyethanol, Cocos Nucifera (Coconut) Oil, Linalool, LavandulaHybrida Oil, Pelargonium Graveolens Flower Oil, Eucalyptus Globulus Leaf Oil, Geraniol, Acacia Decurrens Flower Wax, Rosa Multiflora Flower Wax, Tocopherol, Anthemis Nobilis Flower Oil, Cocoyl Hydrolyzed Collagen, Limonene, Mentha Arvensis Leaf Oil, Simmondsia Chinensis (Jojoba) Seed Oil, Citrus Aurantium Dulcis (Orange) Oil, Fragrance (Parfum), Vitis Vinifera (Grape) Seed Oil, Menthol, Eugenia Caryophyllus (Clove) Leaf Oil, Citral, Padina Pavonica Thallus Extract.",https://www.sephora.com/product/elemis-pro-collagen-makeup-melting-cleansing-balm-P510323,Cleanser,
Revitalizing Supreme+ Youth Power Cream Moisturizer with Hyaluronic Acid,Estée Lauder,$120.00 ,Size: 1.69 oz/ 50 mL,"-Cactus Stem Cell Extract and Hyaluronic Acid -Exclusive Moringa Extract -Exclusive Hibiscus Morning Bloom Extract Water/Aqua/Eau, Dimethicone, Glycerin, Isohexadecane, Butylene Glycol, Bis-PEG-18 Methyl Ether Dimethyl Silane, PEG-10 Dimethicone, Disteardimonium Hectorite, Moringa Oleifera Seed Extract, Hibiscus Sinensis Flower Extract, Sodium Hyaluronate, Acetyl Hexapeptide-8, Laminaria Digitata Extract, Whey Protein/Lactis Protein/Proteine Du Petit-Lait, Opuntia Tuna Extract, Acetyl Glucosamine, Tocopheryl Acetate, Narcissus Tazetta Bulb Extract, Squalane, Algae Extract, Hypnea Musciformis (Algae) Extract, Pyrus Malus (Apple) Fruit Extract, Cucumis Sativus (Cucumber) Fruit Extract, Lens Esculenta (Lentil) Fruit Extract, Citrullus Lanatus (Watermelon) Fruit Extract, Silybum Marianum (Lady's Thistle) Extract, Gelidiella Acerosa Extract, Helianthus Annuus (Sunflower) Seed Extract, Sigesbeckia Orientalis (St. Paul's Wort) Extract, Caffeine, Hordeum Vulgare (Barley) Extract/Extrait D'Orge, Sodium Lactate, Triticum Vulgare (Wheat) Germ Extract, Sorbitol, Propylene Glycol Dicaprate, Sucrose, Sodium PCA, Aminopropyl Ascorbyl Phosphate, Pentylene Glycol, Caprylyl Glycol, Propylene Carbonate, Polyethylene, Polysilicone-11, PEG-32, PEG-6, Disodium EDTA, Isoceteth-20, Isododecane, Citric Acid, Fragrance (Parfum), BHT, Sodium Citrate, Potassium Sorbate, Sodium Dehydroacetate, Sodium Benzoate, Phenoxyethanol, Iron Oxides (CI 77491).",https://www.sephora.com/product/estee-lauder-revitalizing-supreme-youth-power-creme-moisturizer-P479839,Moisturizer,Hydrating
Advanced Night Repair Synchronized Multi-Recovery Complex Serum with Hyaluronic Acid,Estée Lauder,$130.00 ,Size: 1.7 oz/ 50 mL,"-Exclusive Night Peptides: Supports skin’s visible renewal. -Hyaluronic Acid: Locks in moisture. -Antioxidant Power: Defends skin against free radical damage. Water\Aqua\Eau, Bifida Ferment Lysate, Peg-8, Propanediol, Bis-Peg-18 Methyl Ether Dimethyl Silane, Methyl Gluceth-20, Glycereth-26, Peg-75, Butylene Glycol, Adansonia Digitata Seed Extract, Tripeptide-32, Sodium Hyaluronate, Yeast Extract\Faex\Extrait De Levure, Lactobacillus Ferment, Cola Acuminata (Kola) Seed Extract, Anthemis Nobilis (Chamomile) Flower Extract, Hydrolyzed Algin, Pantethine, Caffeine, Lecithin, Sodium Rna, Bisabolol, Squalane, Glycerin, Oleth-3 Phosphate, Caprylyl Glycol, Oleth-3, Oleth-5, Choleth-24, Hydrogenated Lecithin, Jojoba Wax Peg-120 Esters, Ceteth-24, Tocopheryl Acetate, Carbomer, Triethanolamine, Tetrasodium Edta, Bht, Xanthan Gum, Potassium Sorbate, Disodium Edta, Phenoxyethanol, Red 4 (Ci 14700), Yellow 5 (Ci 19140).",https://www.sephora.com/product/estee-lauder-advanced-night-repair-synchronized-multi-recovery-complex-P461159,Serum,"Hydrating, Nourishing"
